publication_name,iso_source_abbreviation
LECTURE NOTES IN NETWORKS AND SYSTEMS,LECT NOTES NETWORKS SYST
TECHNOLOGICAL FORECASTING AND SOCIAL CHANGE,TECHNOL FORECAST SOC CHANGE
JOURNAL OF BUSINESS RESEARCH,J BUS RES
EAISPRINGER INNOVATIONS IN COMMUNICATION AND COMPUTING,EAI/SPRINGER INNO COMM COMP
PERTANIKA JOURNAL OF SOCIAL SCIENCES AND HUMANITIES,PERTANIKA J SOC SCI HUMANIT
REVISTA ESPANOLA DE LA TRANSPARENCIA,REV ESP TRANS
FINANCIAL INNOVATION,FINANCIAL INNOV
JOURNAL OF BEHAVIORAL AND EXPERIMENTAL FINANCE,J BEHAV EXP FINANC
TELEMATICS AND INFORMATICS,TELEMATICS INF
IEEE TRANSACTIONS ON ENGINEERING MANAGEMENT,IEEE TRANS ENG MANAGE
INTERNATIONAL JOURNAL OF INFORMATION MANAGEMENT,INT J INF MANAGE
RENEWABLE ENERGY,RENEW ENERGY
RESEARCH IN INTERNATIONAL BUSINESS AND FINANCE,RES INT BUS FINANC
ECONOMIC MODELLING,ECON MODEL
INTERNATIONAL JOURNAL OF PRODUCTION ECONOMICS,INT J PROD ECON
JOURNAL OF DEVELOPMENT ECONOMICS,J DEV ECON
INDUSTRIAL MANAGEMENT AND DATA SYSTEMS,IND MANAGE DATA SYS
REVIEW OF FINANCIAL STUDIES,REV FINANC STUD
INTERNATIONAL JOURNAL OF INFORMATION SYSTEMS IN THE SERVICE SECTOR,INT J INF SYST SERV SECT
INTERNATIONAL REVIEW OF FINANCIAL ANALYSIS,INT REV FINANC ANAL
APPLIED GEOGRAPHY,APPL GEOGR
INTERNATIONAL JOURNAL OF FORECASTING,INT J FORECAST
JOURNAL OF BUSINESS ECONOMICS,J BUS ECON
BRITISH JOURNAL OF MANAGEMENT,BR J MANAGE
SMALL BUSINESS ECONOMICS,SMALL BUS ECON
2021 11TH INTERNATIONAL CONFERENCE ON ADVANCED COMPUTER INFORMATION TECHNOLOGIES ACIT 2021  PROCEEDINGS,"INT CONF ADV COMPUT INF TECHNOL, ACIT - PROC"
CHINA QUARTERLY,CHINA Q
ELECTRONIC COMMERCE RESEARCH AND APPLICATIONS,ELECT COMMER RES APPL
UNIVERSITY OF NEW SOUTH WALES LAW JOURNAL,UNIV NEW SOUTH WALES LAW J
JOURNAL OF OPEN INNOVATION TECHNOLOGY MARKET AND COMPLEXITY,J OPEN INNOV: TECHNOL MARK COMPLEX
EUROPEAN BUSINESS ORGANIZATION LAW REVIEW,EUR BUS ORG LAW REV
MANAGEMENT SCIENCE,MANAGE SCI
EMPIRICAL SOFTWARE ENGINEERING,EMPIR SOFTWARE ENG
ENGINEERING APPLICATIONS OF ARTIFICIAL INTELLIGENCE,ENG APPL ARTIF INTELL
JOURNAL OF EMPIRICAL FINANCE,J EMPIR FINANC
FINANCIAL MANAGEMENT,FINANC MANAGE
MANCHESTER SCHOOL,MANCHESTER SCH
BUSINESS THEORY AND PRACTICE,BUS THEORY PRACT
PROCEEDINGS OF 2021 INTERNATIONAL CONFERENCE ON INFORMATION MANAGEMENT AND TECHNOLOGY ICIMTECH 2021,"PROC INT CONF INF MANAG TECHNOL, ICIMTECH"
IOP CONFERENCE SERIES EARTH AND ENVIRONMENTAL SCIENCE,IOP CONF SER EARTH ENVIRON SCI
HELIYON,HELIYON
INTERNATIONAL JOURNAL OF FINANCIAL STUDIES,INTERN J FINANCIAL STUD
JISUANJI YANJIU YU FAZHANCOMPUTER RESEARCH AND DEVELOPMENT,JISUANJI YANJIU YU FAZHAN
INTERNATIONAL JOURNAL OF DATA SCIENCE AND ANALYTICS,INT J DATA SCI ANAL
SUSTAINABILITY SWITZERLAND,SUSTAINABILITY
APPLIED SCIENCES SWITZERLAND,APPL SCI
JOURNAL OF THEORETICAL AND APPLIED ELECTRONIC COMMERCE RESEARCH,J THEOR APPL ELECTRON COMMER RES
PROGRESS IN HUMAN GEOGRAPHY,PROG HUM GEOGR
LEX LOCALIS,LEX LOCALIS
FINTECH ARTIFICIAL INTELLIGENCE AND THE LAW REGULATION AND CRIME PREVENTION,"FINTECH, ARTIF INTELL AND THE LAW: REGUL AND CRIME PREV"
COMPUTER NETWORKS,COMPUT NETWORKS
CHINA AND WORLD ECONOMY,CHINA WORLD ECON
ENVIRONMENTAL SCIENCE AND ECOTECHNOLOGY,ENVIRON SCI ECOTECHNOL
STRATEGIC CHANGE,STRATEG CHANGE
JOURNAL OF INTERNATIONAL FINANCIAL MARKETS INSTITUTIONS AND MONEY,J INT FINANC MARK INST MONEY
JOURNAL OF SOFTWARE EVOLUTION AND PROCESS,J SOFTW EVOL PROCESS
NORTH AMERICAN JOURNAL OF ECONOMICS AND FINANCE,NORTH AM J ECON FINANC
ENERGY POLICY,ENERGY POLICY
INTERNATIONAL REVIEW OF ECONOMICS AND FINANCE,INT REV ECON FINANC
INFORMATION SYSTEMS JOURNAL,INF SYST J
JOURNAL OF COMPUTATIONAL AND APPLIED MATHEMATICS,J COMPUT APPL MATH
FINANCE RESEARCH LETTERS,FINAN RES LETT
ICAICST 2021  2021 INTERNATIONAL CONFERENCE ON ARTIFICIAL INTELLIGENCE AND COMPUTER SCIENCE TECHNOLOGY,ICAICST - INT CONF ARTIF INTELL COMPUT SCI TECHNOL
JOURNAL OF PHYSICS CONFERENCE SERIES,J PHYS CONF SER
IBERIAN CONFERENCE ON INFORMATION SYSTEMS AND TECHNOLOGIES CISTI,"IBERIAN CONF INF SYST TECHNOL, CISTI"
E3S WEB OF CONFERENCES,E3S WEB CONF
THE ROUTLEDGE HANDBOOK OF FINTECH,THE ROUT HANDB OF FINTECH
ELECTRONICS SWITZERLAND,ELECTRONICS (SWITZERLAND)
MIS QUARTERLY MANAGEMENT INFORMATION SYSTEMS,MIS QUART MANAGE INF SYST
ZBORNIK RADOVA EKONOMSKOG FAKULTET AU RIJECI,ZBORNIK RADOVA EKONOMSKOG FAKULTET AU RIJECI
SOCIETY,SOCIETY
PACIFIC BASIN FINANCE JOURNAL,PAC BASIN FINANC J
GEOFORUM,GEOFORUM
JOURNAL OF CORPORATE FINANCE,J CORP FINANC
MICROPROCESSORS AND MICROSYSTEMS,MICROPROCESSORS MICROSYST
JOURNAL OF BUSINESS VENTURING INSIGHTS,J BUS VENTUR INSIGHTS
JOURNAL OF CONSUMER AFFAIRS,J CONSUM AFF
ACM INTERNATIONAL CONFERENCE PROCEEDING SERIES,ACM INT CONF PROC SER
IEEE INTERNATIONAL CONFERENCE ON ELECTRO INFORMATION TECHNOLOGY,IEEE INT CONF ELECTRO INFORM TECHNOL
CONFERENCE ON HUMAN FACTORS IN COMPUTING SYSTEMS  PROCEEDINGS,CONF HUM FACT COMPUT SYST PROC
PROCEEDINGS OF THE 2021 IEEE 24TH INTERNATIONAL CONFERENCE ON COMPUTER SUPPORTED COOPERATIVE WORK IN DESIGN CSCWD 2021,"PROC IEEE INT CONF COMPUT SUPPORT COOP WORK DES, CSCWD"
RISKS,RISKS
TELECOMMUNICATIONS POLICY,TELECOMMUN POLICY
TECHNOVATION,TECHNOVATION
EXPERT SYSTEMS WITH APPLICATIONS,EXPERT SYS APPL
2021 IEEE 6TH INTERNATIONAL CONFERENCE ON CLOUD COMPUTING AND BIG DATA ANALYTICS ICCCBDA 2021,"IEEE INT CONF CLOUD COMPUT BIG DATA ANAL, ICCCBDA"
50 YEARS OF CENTRAL BANKING IN KENYA,50 YEARS OF CENTRAL BANK IN KENYA
2021 IEEE INTERNATIONAL IOT ELECTRONICS AND MECHATRONICS CONFERENCE IEMTRONICS 2021  PROCEEDINGS,"IEEE INT IOT, ELECTRON MECHATRONICS CONF, IEMTRONICS - PROC"
JOURNAL OF ACCOUNTING AND ORGANIZATIONAL CHANGE,J ACCOUNT ORGAN CHANGE
ABAC JOURNAL,ABAC J
LAND USE POLICY,LAND USE POLICY
ENVIRONMENTAL SCIENCE AND POLLUTION RESEARCH,ENVIRON SCI POLLUT RES
JOURNAL OF FINANCIAL STABILITY,J FINANC STAB
ISLAMIC FINTECH,ISLAMIC FINTECH
INTERNATIONAL JOURNAL OF LAW AND MANAGEMENT,INT J LAW MANAGE
FINANCIAL AND ECONOMIC SYSTEMS TRANSFORMATIONS AND NEW CHALLENGES,FINANC AND ECON SYS: TRANSFORM AND NEW CHALL
PROCEEDINGS OF 2ND IEEE INTERNATIONAL CONFERENCE ON COMPUTATIONAL INTELLIGENCE AND KNOWLEDGE ECONOMY ICCIKE 2021,"PROC IEEE INT CONF COMPUT INTELL KNOWL ECON, ICCIKE"
PROCEEDING OF THE 2021 9TH INTERNATIONAL ELECTRICAL ENGINEERING CONGRESS IEECON 2021,"PROCEEDING INT ELECTR ENG CONGR, IEECON"
COVID19 AND ISLAMIC SOCIAL FINANCE,COVID-19 AND ISLAMIC SOCIAL FINANCE
JOURNAL OF ISLAMIC ACCOUNTING AND BUSINESS RESEARCH,J ISLAMIC ACCOUNT BUS RES
MATHEMATICS,MATHEMATICS
BANKING LAW JOURNAL,BANK LAW J
JOURNAL OF DATA PROTECTION AND PRIVACY,J DATA PROT PRIV
CATO JOURNAL,CATO J
JOURNAL OF PAYMENTS STRATEGY AND SYSTEMS,J PAYM STRATEG SYST
REVIEW OF FINANCE,REV FINANC
SERVICE SCIENCE,SERV SCI
INFORMATION SYSTEMS RESEARCH,INF SYST RES
JOURNAL OF BRAND STRATEGY,J BRAND STRAT
SENSORS,SENSORS
ENERGY RESEARCH AND SOCIAL SCIENCE,ENERGY RES SOC SCI
JOURNAL OF FINANCIAL SERVICES MARKETING,J FINAN SERV MARK
FINANCIAL MARKETS AND PORTFOLIO MANAGEMENT,FINANC MARK PORTF MANAGE
JOURNAL OF BANKING REGULATION,J BANK REGUL
MANAGERIAL FINANCE,MANAG FINANC
PROCEEDINGS OF INTERNATIONAL CONFERENCE ON INNOVATIVE PRACTICES IN TECHNOLOGY AND MANAGEMENT ICIPTM 2021,"PROC INT CONF INNOV PRACT TECHNOL MANAG, ICIPTM"
INVESTMENT MANAGEMENT AND FINANCIAL INNOVATIONS,INVESTM MANANGE FINANC INNOV
JOURNAL OF PROPERTY INVESTMENT AND FINANCE,J PROP INVEST FINAN
ECONOMIC ANNALSXXI,ECO ANNALS
RISTI  REVISTA IBERICA DE SISTEMAS E TECNOLOGIAS DE INFORMACAO,REV IBERICA SIST TECNOL INF
MULTIDISCIPLINARY SCIENCE AND ADVANCED TECHNOLOGIES,MULTIDISCIPLINARY SCIENCE AND ADVANCED TECHNOLOGIES
JOURNAL OF CLEANER PRODUCTION,J CLEAN PROD
JOURNAL OF FINANCIAL REGULATION AND COMPLIANCE,J FINANC REGUL COMPLIANCE
PROCEEDINGS OF 2ND INTERNATIONAL CONFERENCE ON COMPUTATION AUTOMATION AND KNOWLEDGE MANAGEMENT ICCAKM 2021,"PROC INT CONF COMPUT, AUTOM KNOWL MANAG, ICCAKM"
INNOVATIONS,INNOVATIONS
BANKS AND BANK SYSTEMS,BANKS BANK SYST
PROCEDIA COMPUTER SCIENCE,PROCEDIA COMPUT SCI
JOURNAL OF SMALL BUSINESS AND ENTERPRISE DEVELOPMENT,J SMALL BUS ENTERP DEV
EUROPEAN COMPETITION JOURNAL,EUR COMPET J
QUALITATIVE RESEARCH IN FINANCIAL MARKETS,QUAL RES FINANC MARKETS
FRACTALS,FRACTALS
COGENT ECONOMICS AND FINANCE,COGENT ECON FINANCE
JOURNAL OF MULTINATIONAL FINANCIAL MANAGEMENT,J MULTINATL FINANC MANAGE
JOURNAL OF CULTURAL ECONOMY,J CULT ECON
JOURNAL OF MONETARY ECONOMICS,J MONET ECON
POTCHEFSTROOM ELECTRONIC LAW JOURNAL,POTCHEFSTROOM ELECTRON LAW J
APPLIED ECONOMICS LETTERS,APPL ECON LETT
EUROPEAN JOURNAL OF INFORMATION SYSTEMS,EUR J INF SYST
JOURNAL OF APPLIED ACCOUNTING RESEARCH,J APPL ACCOUNT RES
COMMUNICATIONS IN COMPUTER AND INFORMATION SCIENCE,COMMUN COMPUT INFO SCI
EUROPEAN JOURNAL OF RISK REGULATION,EUR J RISK REGUL
JOURNAL OF SERVICE MANAGEMENT,J SERV MANAGE
ICASSP IEEE INTERNATIONAL CONFERENCE ON ACOUSTICS SPEECH AND SIGNAL PROCESSING  PROCEEDINGS,ICASSP IEEE INT CONF ACOUST SPEECH SIGNAL PROCESS PROC
IEEE INTERNET OF THINGS JOURNAL,IEEE INTERNET THINGS J
INTERNATIONAL JOURNAL OF BANK MARKETING,INT J BANK MARK
ECONOMIC RESEARCHEKONOMSKA ISTRAZIVANJA ,ECONOMIC RES EKON ISTRAZ
INTERNATIONAL JOURNAL FOR QUALITY RESEARCH,INT J QUAL RES
PROCEEDINGS OF THE INTERNATIONAL CONFERENCE ON INDUSTRIAL ENGINEERING AND OPERATIONS MANAGEMENT,PROC INT CONF IND ENG OPER MANAGE
EMERGING MARKETS REVIEW,EMERG MARK REV
AUSTRALIAN EDUCATIONAL RESEARCHER,AUST EDUC RES
MANAGERIAL AND DECISION ECONOMICS,MANAGE DECIS ECON
GLOBAL BUSINESS REVIEW,GLOBAL BUS REV
INTERNATIONAL JOURNAL OF ORGANIZATIONAL ANALYSIS,INT J ORGAN ANAL
JOURNAL OF MODELLING IN MANAGEMENT,J MODEL MANAGE
INTERNATIONAL JOURNAL OF SERVICES ECONOMICS AND MANAGEMENT,INT J SERV ECON MANAG
JOURNAL OF FINANCIAL SERVICES RESEARCH,J FINANC SERV RES
PUBLIC AND MUNICIPAL FINANCE,PUBLIC MUNIC FINANCE
WORLD SCIENTIFIC SERIES IN FINANCE,WORLD SCI SER FINANC
STUDIES IN COMPUTATIONAL INTELLIGENCE,STUD COMPUT INTELL
INTERNATIONAL JOURNAL OF MANPOWER,INT J MANPOW
INTERNATIONAL JOURNAL OF ISLAMIC AND MIDDLE EASTERN FINANCE AND MANAGEMENT,INT J ISLAM MIDDLE EAST FINANC MANAGE
SOFTWARE  PRACTICE AND EXPERIENCE,SOFTWARE PRACT EXPER
LECTURE NOTES IN COMPUTER SCIENCE INCLUDING SUBSERIES LECTURE NOTES IN ARTIFICIAL INTELLIGENCE AND LECTURE NOTES IN BIOINFORMATICS,LECT NOTES COMPUT SCI
JOURNAL OF CREATIVE COMMUNICATIONS,J CREAT COMMUN
CEUR WORKSHOP PROCEEDINGS,CEUR WORKSHOP PROC
INTERNATIONAL JOURNAL OF MANAGEMENT PRACTICE,INT J MANAGE PRACT
JOURNAL OF SUSTAINABLE FINANCE AND INVESTMENT,JOURNAL OF SUSTAIN FINANCE INVEST
SPRINGER PROCEEDINGS IN COMPLEXITY,SPRINGER PROC COMPLEX
INTERNATIONAL JOURNAL OF BUSINESS PERFORMANCE MANAGEMENT,INT J BUS PERFORM MANAGE
BLOCKCHAIN AND SMART CONTRACTS DESIGN THINKING AND PROGRAMMING FOR FINTECH,BLOCKCHAIN AND SMART CONTRACTS: DESIGN THINK AND PROGRAM FOR FINTECH
BALKAN SOCIAL SCIENCE REVIEW,BALKAN SOC SCI REV
ESTUDIOS DE ECONOMIA APLICADA,ESTUD ECON APL
AUSTRALIAN JOURNAL OF MANAGEMENT,AUST J MANAGE
UNIVERSITY OF ILLINOIS LAW REVIEW,UNIV ILL LAW REV
NEW POLITICAL ECONOMY,NEW POLIT ECON
ROUTLEDGE HANDBOOK OF FINANCIAL TECHNOLOGY AND LAW,ROUTLEDGE HANDB OF FINANCIAL TECHNOLOGY AND LAW
TECHNOLOGY ANALYSIS AND STRATEGIC MANAGEMENT,TECHNOL ANAL STRATEG MANAGE
JOURNAL OF FINANCIAL AND QUANTITATIVE ANALYSIS,J FINANC QUANT ANAL
ASIAN ACADEMY OF MANAGEMENT JOURNAL OF ACCOUNTING AND FINANCE,ASIAN ACAD MANAGE J ACCOUNT FINANC
EUROPEAN JOURNAL OF FINANCE,EUR J FINANC
JOURNAL OF INTERNATIONAL STUDIES,J INTL STUD
JOURNAL OF ECONOMIC DYNAMICS AND CONTROL,J ECON DYN CONTROL
PALGRAVE STUDIES IN DEMOCRACY INNOVATION AND ENTREPRENEURSHIP FOR GROWTH,PALGRAVE STUD DEM INNOV ENTREP
IOWA LAW REVIEW,IOWA LAW REV
AREA,AREA
E A M EKONOMIE A MANAGEMENT,E M EKON MANAGE
FORESIGHT,FORESIGHT
JOURNAL OF FINANCIAL ECONOMICS,J FINANC ECON
INQUIRY UNITED STATES,INQUIRY
AI AND SOCIETY,AI SOC
EUROPEAN BUSINESS LAW REVIEW,EUR BUS LAW REV
INTERNATIONAL JOURNAL OF TECHNOLOGY MANAGEMENT,INT J TECHNOL MANAGE
WIRELESS COMMUNICATIONS AND MOBILE COMPUTING,WIRELESS COMMUN MOBILE COMPUT
PROCEEDINGS OF THE ANNUAL HAWAII INTERNATIONAL CONFERENCE ON SYSTEM SCIENCES,PROC ANNU HAWAII INT CONF SYST SCI
ELECTRONIC COMMERCE RESEARCH,ELECTRON COMMER RES
INTERNATIONAL JOURNAL OF ELECTRONIC FINANCE,INT J ELECTRON FINANCE
GERMAN LAW JOURNAL,GERMAN LAW J
BIG DATA AND SOCIETY,BIG DATA SOC
ENTERPRISE INFORMATION SYSTEMS,ENTERP INF SYST
MEASURING BUSINESS EXCELLENCE,MEASURING BUS EXCELLENCE
ADVANCES IN INTELLIGENT SYSTEMS AND COMPUTING,ADV INTELL SYS COMPUT
KASETSART JOURNAL OF SOCIAL SCIENCES,KASETSART J SOC SCI
STUDIES IN ECONOMICS AND FINANCE,STUD ECON FINANC
ACADEMY OF ACCOUNTING AND FINANCIAL STUDIES JOURNAL,ACAD ACCOUNT FINANC STUD J
SPRINGERBRIEFS IN COMPUTER SCIENCE,SPRINGERBRIEFS COMP SCI
BUSINESS PROCESS MANAGEMENT JOURNAL,BUS PROCESS MANAGE J
JOURNAL OF DEVELOPMENT STUDIES,J DEV STUD
INTERNATIONAL JOURNAL OF KNOWLEDGE AND LEARNING,INT J KNOWL LEARN
STRATEGIC DIRECTION,STRATEG DIR
EMERGING MARKETS FINANCE AND TRADE,EMERG MARK FINANC TRADE
JOURNAL OF COMPUTER INFORMATION SYSTEMS,J COMPUT INF SYST
APPLIED ECONOMICS,APPL ECON
INFORMATION SWITZERLAND,INFORMATION
COMPUTATIONAL ECONOMICS,COMPUT ECON
LAW AND CONTEMPORARY PROBLEMS,LAW CONTEMP PROBL
COMPUTER SCIENCE AND INFORMATION SYSTEMS,COMP SCI INFO SYS
JOURNAL OF SYSTEMS SCIENCE AND INFORMATION,J SYST SCI INF
NEURAL COMPUTING AND APPLICATIONS,NEURAL COMPUT APPL
INTERNATIONAL SYMPOSIA IN ECONOMIC THEORY AND ECONOMETRICS,INT SYMP ECON ECONOM THEORY ECONOM
INTERNATIONAL CONFERENCE ON INFORMATION SYSTEMS ICIS 2020  MAKING DIGITAL INCLUSIVE BLENDING THE LOCAL AND THE GLOBAL,"INT CONF INF SYST, ICIS - MAK DIGIT INCL: BLENDING LOCAL GLOB"
ECONOMY AND SOCIETY,ECON SOC
WORLD ECONOMY AND INTERNATIONAL RELATIONS,WORLD ECONOMY INT RELAT
BRAZILIAN BUSINESS REVIEW,BRAZILIAN BUS REV
JOURNAL OF ECONOMIC STUDIES,J ECON STUD
INTERNATIONAL JOURNAL OF CENTRAL BANKING,INT J CENT BANK
IEEE ACCESS,IEEE ACCESS
PUBLIC ADMINISTRATION,PUBLIC ADM
STUDIES IN SYSTEMS DECISION AND CONTROL,STUD SYST DECIS CONTROL
INTERNATIONAL JOURNAL OF INTELLECTUAL PROPERTY MANAGEMENT,INT J INTELLECT PROP MANAGE
LECTURE NOTES IN MECHANICAL ENGINEERING,LECT NOTES MECH ENG
INTERNATIONAL JOURNAL OF ECONOMICS AND BUSINESS RESEARCH,INT J ECONOMICS BUSINESS RESEARCH
INTERNATIONAL JOURNAL OF DISCLOSURE AND GOVERNANCE,INT J DISCL GOV
JOURNAL OF ASIA BUSINESS STUDIES,J ASIA BUS STUD
INFORMATION DISCOVERY AND DELIVERY,INFORMATION DISCOV DELIV
JOURNAL OF ENTERPRISING COMMUNITIES,J ENTERPRISING COMMUNITIES
JOURNAL OF GENDER STUDIES,J GENDER STUD
ISLAMIC LAW AND SOCIETY,ISLAMIC LAW SOC
INVESTMENT ANALYSTS JOURNAL,INVESTM ANALYSTS J
INTERNATIONAL JOURNAL OF BUSINESS INNOVATION AND RESEARCH,INT J BUS INNOV RES
INTERNATIONAL JOURNAL OF FINANCE AND ECONOMICS,INT J FINANC ECON
APPLIED ECONOMIC PERSPECTIVES AND POLICY,APPL ECON PERSPECT POLICY
ASIA PACIFIC BUSINESS REVIEW,ASIA PAC BUS REV
REVIEW OF MANAGERIAL SCIENCE,REV MANAGE SCI
JOURNAL OF THE ASSOCIATION FOR INFORMATION SYSTEMS,J ASSOC INF SYST
ECONOMICS OF INNOVATION AND NEW TECHNOLOGY,ECON INNOV NEW TECHNOL
REVISTA BRASILEIRA DE MARKETING,REV BRAS MARK
INTERNATIONAL JOURNAL OF BUSINESS INTELLIGENCE RESEARCH,INT J BUS INTELL RES
ADVANCES IN INFORMATION SECURITY,ADVANCES IN INFORMATION SECURITY
INFORMATION TECHNOLOGY FOR DEVELOPMENT,INF TECHNOL DEV
INTERNATIONAL JOURNAL OF ECOLLABORATION,INT J E-COLLAB
ACCOUNTING,ACCOUNT
LECTURE NOTES IN ELECTRICAL ENGINEERING,LECT NOTES ELECTR ENG
DYNAMICS OF ASYMMETRIC CONFLICT PATHWAYS TOWARD TERRORISM AND GENOCIDE,DYN ASYMMETRIC CONFL PATHWAYS TOWARD TERRORISM AND GENOCIDE
JOURNAL OF SMALL BUSINESS AND ENTREPRENEURSHIP,J SMALL BUS ENTREP
DARK SIDE OF DIGITAL ORGANIZATION,DARK SIDE OF DIGIT ORGAN
2020 INTERNATIONAL CONFERENCE ON INNOVATION AND INTELLIGENCE FOR INFORMATICS COMPUTING AND TECHNOLOGIES 3ICT 2020,"INT CONF INNOV INTELL INFORMATICS, COMPUT TECHNOL, 3ICT"
2020 8TH INTERNATIONAL CONFERENCE ON ORANGE TECHNOLOGY ICOT 2020,"INT CONF ORANGE TECHNOL, ICOT"
PROCEEDINGS  2020 IEEE INTERNATIONAL CONFERENCE ON BIG DATA BIG DATA 2020,"PROC - IEEE INT CONF BIG DATA, BIG DATA"
ICAC 2020  2ND INTERNATIONAL CONFERENCE ON ADVANCEMENTS IN COMPUTING PROCEEDINGS,"ICAC - INT CONF ADV COMPUT, PROC"
2020 3RD INTERNATIONAL SEMINAR ON RESEARCH OF INFORMATION TECHNOLOGY AND INTELLIGENT SYSTEMS ISRITI 2020,"INT SEMIN RES INF TECHNOL INTELL SYST, ISRITI"
MANAGEMENT DECISION,MANAGE DECIS
ACCOUNTING PERSPECTIVES,ACCOUNT PERSP
INFORMATION AND MANAGEMENT,INF MANAGE
FRONTIERS OF BUSINESS RESEARCH IN CHINA,FRONT BUS RES CHINA
WIRELESS PERSONAL COMMUNICATIONS,WIRELESS PERS COMMUN
PACIFIC ECONOMIC REVIEW,PAC ECON REV
SINGAPORE ECONOMIC REVIEW,SINGAP ECON REV
13TH CMI CONFERENCE ON CYBERSECURITY AND PRIVACY  DIGITAL TRANSFORMATION  POTENTIALS AND CHALLENGES CMI 2020,"CMI CONF CYBERSECUR PRIV - DIGIT TRANSFORM - POTENTIALS CHALLENGES, CMI"
SCIENTIFIC PAPERS OF THE UNIVERSITY OF PARDUBICE SERIES D FACULTY OF ECONOMICS AND ADMINISTRATION,SCI PAP UNIV PARDUBICE SER D FAC ECON ADM
BEYOND FINTECH TECHNOLOGY APPLICATIONS FOR THE ISLAMIC ECONOMY,BEYOND FINTECH: TECHNOLOGY APPLICATIONS FOR THE ISLAMIC ECONOMY
PROCEEDINGS  2020 15TH INTERNATIONAL JOINT SYMPOSIUM ON ARTIFICIAL INTELLIGENCE AND NATURAL LANGUAGE PROCESSING ISAINLP 2020,"PROC - INT JT SYMP ARTIF INTELL NAT LANG PROCESS, ISAI-NLP"
INTERNATIONAL SYMPOSIUM ON TECHNOLOGY AND SOCIETY PROCEEDINGS,INT SYMP TECHNOL SOC
ICETA 2020  18TH IEEE INTERNATIONAL CONFERENCE ON EMERGING ELEARNING TECHNOLOGIES AND APPLICATIONS PROCEEDINGS,"ICETA - IEEE INT CONF EMERG ELEARNING TECHNOL APPL, PROC"
PROCEEDINGS OF THE 15TH IEEE CONFERENCE ON INDUSTRIAL ELECTRONICS AND APPLICATIONS ICIEA 2020,"PROC IEEE CONF IND ELECTRON APPL, ICIEA"
2020 INTERNATIONAL CONFERENCE ON DECISION AID SCIENCES AND APPLICATION DASA 2020,"INT CONF DECIS AID SCI APPL, DASA"
ESECFSE 2020  PROCEEDINGS OF THE 28TH ACM JOINT MEETING EUROPEAN SOFTWARE ENGINEERING CONFERENCE AND SYMPOSIUM ON THE FOUNDATIONS OF SOFTWARE ENGINEERING,ESEC/FSE - PROC ACM JT MEET EUR SOFTW ENG CONF SYMP FOUND SOFTW ENG
PROCEEDINGS  2020 IEEE 13TH INTERNATIONAL CONFERENCE ON SERVICES COMPUTING SCC 2020,"PROC - IEEE INT CONF SERV COMPUT, SCC"
PROCEEDINGS  INTERNATIONAL CONFERENCE ON TOOLS WITH ARTIFICIAL INTELLIGENCE ICTAI,PROC INT CONF TOOLS ARTIF INTELL ICTAI
HARVARD BUSINESS REVIEW,HARV BUS REV
JOURNAL OF ACCOUNTING AND ECONOMICS,J ACCOUNT ECON
FUTURE GENERATION COMPUTER SYSTEMS,FUTURE GENER COMPUT SYST
JOURNAL OF ECONOMICS AND BUSINESS,J ECON BUS
ENVIRONMENT AND PLANNING A,ENVIRON PLANN A
2020 INTERNATIONAL CONFERENCE ON DATA ANALYTICS FOR BUSINESS AND INDUSTRY WAY TOWARDS A SUSTAINABLE ECONOMY ICDABI 2020,"INT CONF DATA ANAL BUS IND: WAY TOWARDS SUSTAIN ECON, ICDABI"
2020 INTERNATIONAL SYMPOSIUM ON NETWORKS COMPUTERS AND COMMUNICATIONS ISNCC 2020,"INT SYMP NETWORKS, COMPUT COMMUN, ISNCC"
6TH INTERNATIONAL CONFERENCE ON COMPUTING ENGINEERING AND DESIGN ICCED 2020,"INT CONF COMPUT, ENG, DES, ICCED"
PROCEEDING  1ST INTERNATIONAL CONFERENCE ON INFORMATION TECHNOLOGY ADVANCED MECHANICAL AND ELECTRICAL ENGINEERING ICITAMEE 2020,"PROCEEDING - INT CONF INF TECHNOL, ADV MECH ELECTR ENG, ICITAMEE"
ANNUAL REVIEW OF LAW AND SOCIAL SCIENCE,ANNU REV LAW SOC SCI
PROCEEDINGS OF BHTC 2020  1ST IEEE BANGALORE HUMANITARIAN TECHNOLOGY CONFERENCE,PROC B-HTC - IEEE BANGALORE HUMANIT TECHNOL CONF
TRANSNATIONAL MARKETING JOURNAL,TRANSNATL MARK J
INTERNATIONAL JOURNAL OF ASIAN BUSINESS AND INFORMATION MANAGEMENT,INT J ASIAN BUS INF MANAG
CAPITAL MARKETS LAW JOURNAL,CAP MARK LAW J
PROCEEDINGS  2020 IEEE 7TH INTERNATIONAL CONFERENCE ON DATA SCIENCE AND ADVANCED ANALYTICS DSAA 2020,"PROC - IEEE INT CONF DATA SCI ADV ANAL, DSAA"
INTERNATIONAL JOURNAL OF FINANCIAL RESEARCH,INT J FINANCIAL RES
INTERNATIONAL JOURNAL OF CRIMINOLOGY AND SOCIOLOGY,INT J CRIMINOL SOCIOL
AMERICAN BEHAVIORAL SCIENTIST,AM BEHAV SCI
JOURNAL OF ECONOMIC BEHAVIOR AND ORGANIZATION,J ECON BEHAV ORGAN
CHINA FINANCE REVIEW INTERNATIONAL,CHINA FINANCE REV INT
JOURNAL OF FINANCIAL REGULATION,J FINANC REGUL
DIGITAL POLICY REGULATION AND GOVERNANCE ,DIGIT POLI REGUL GOVERN
JOURNAL OF POVERTY,J POVER
2020 3RD INTERNATIONAL CONFERENCE ON COMPUTER AND INFORMATICS ENGINEERING IC2IE 2020,"INT CONF COMPUT INFORMATICS ENG, IC2IE"
IRANIAN JOURNAL OF MANAGEMENT STUDIES,IRAN J MANAG STUD
2020 2ND CONFERENCE ON BLOCKCHAIN RESEARCH AND APPLICATIONS FOR INNOVATIVE NETWORKS AND SERVICES BRAINS 2020,"CONF BLOCKCHAIN RES APPL INNOV NETWORKS SERV, BRAINS"
TOWARDS THE DIGITAL WORLD AND INDUSTRY X0  PROCEEDINGS OF THE 29TH INTERNATIONAL CONFERENCE OF THE INTERNATIONAL ASSOCIATION FOR MANAGEMENT OF TECHNOLOGY IAMOT 2020,"TOWARDS DIGIT WORLD IND X0 - PROC INT CONF INT ASSOC MANAG TECHNOL, IAMOT"
MACROECONOMICS AND FINANCE IN EMERGING MARKET ECONOMIES,MACROECONOMICS FINANC EMERG MARK ECON
VISION,VISION
INTERNATIONAL REVIEW OF LAW COMPUTERS AND TECHNOLOGY,INT REV LAW COMPUT TECHNOL
ENTREPRENEURSHIP AND REGIONAL DEVELOPMENT,ENTREP REG DEV
PROCEEDINGS  2020 INTERNATIONAL CONFERENCE ON BIG DATA AND SOCIAL SCIENCES ICBDSS 2020,"PROC - INT CONF BIG DATA SOC SCI, ICBDSS"
PROCEEDINGS OF 2020 INTERNATIONAL CONFERENCE ON INFORMATION MANAGEMENT AND TECHNOLOGY ICIMTECH 2020,"PROC INT CONF INF MANAG TECHNOL, ICIMTECH"
THAILAND AND THE WORLD ECONOMY,THAIL WORLD ECON
INTERNATIONAL JOURNAL OF INNOVATION AND TECHNOLOGY MANAGEMENT,INT J INNOV TECHNOL MANAGE
JOURNAL OF INFORMATION PROCESSING SYSTEMS,J INF PROCESS SYST
CHAOS,CHAOS
XITONG GONGCHENG LILUN YU SHIJIANSYSTEM ENGINEERING THEORY AND PRACTICE,XITONG GONGCHENG LILUM YU SHIJIAN
JOURNAL OF BEHAVIORAL AND EXPERIMENTAL ECONOMICS ,J BEHAVE EXP ECON
DIS 2020 COMPANION  COMPANION PUBLICATION OF THE 2020 ACM DESIGNING INTERACTIVE SYSTEMS CONFERENCE,DIS COMPANION - COMPANION PUBL ACM DES INTERACT SYST CONF
INTERNATIONAL JOURNAL OF PUBLIC ADMINISTRATION IN THE DIGITAL AGE,INTL J PUBLIC ADMIN DIGIT AGE
AGROALIMENTARIA,AGROALIMENTARIA
BUSINESS ECONOMICS,BUS ECON
JOURNAL OF FINANCIAL INTERMEDIATION,J FINANC INTERMEDIATION
JOURNAL OF BANKING AND FINANCE,J BANK FINANC
GLOBAL JURIST,GLOBAL JURIST
ECONOMIC NOTES,ECON NOTES
BRITISH ACCOUNTING REVIEW,BR ACCOUNT REV
INTERNET RESEARCH,INTERNET RES
ICRITO 2020  IEEE 8TH INTERNATIONAL CONFERENCE ON RELIABILITY INFOCOM TECHNOLOGIES AND OPTIMIZATION TRENDS AND FUTURE DIRECTIONS,"ICRITO - IEEE INT CONF RELIAB, INFOCOM TECHNOL OPTIM (TRENDS FUTURE DIRECTIONS)"
ASIAN JOURNAL OF LAW AND SOCIETY,ASIAN J LAW SOC
2020 8TH INTERNATIONAL CONFERENCE ON INFORMATION AND COMMUNICATION TECHNOLOGY ICOICT 2020,"INT CONF INF COMMUN TECHNOL, ICOICT"
TECHNOLOGY INNOVATION MANAGEMENT REVIEW,TECHNOLOG INNOV MANAG REV
BIG DATA AND COGNITIVE COMPUTING,BIG DATA COGN COMPUTING
2020 9TH MEDITERRANEAN CONFERENCE ON EMBEDDED COMPUTING MECO 2020,MEDITERR CONF EMBED COMPUT MECO
FORENSIC SCIENCE INTERNATIONAL DIGITAL INVESTIGATION,FOR SCI INT: DIG INVESTIGATION
MAASTRICHT JOURNAL OF EUROPEAN AND COMPARATIVE LAW,MAASTRICHT J EURCOMP LAW
ASIAPACIFIC JOURNAL OF FINANCIAL STUDIES,ASIA-PAC J FINANC STUD
JOURNAL OF OPERATIONS MANAGEMENT,J OPER MANAGE
CHINESE MANAGEMENT STUDIES,CHIN MANAGE STUD
INTERNATIONAL MARKETING REVIEW,INT MARK REV
IOP CONFERENCE SERIES MATERIALS SCIENCE AND ENGINEERING,IOP CONF SER MATER SCI ENG
INTERNATIONAL JOURNAL OF ADVANCED SCIENCE AND TECHNOLOGY,INT J ADV SCI TECHNOL
JOURNAL OF CENTRAL BANKING THEORY AND PRACTICE,J CENT BANK THEORY PRACT
PROCEEDINGS  2020 IEEE 6TH INTL CONFERENCE ON BIG DATA SECURITY ON CLOUD BIGDATASECURITY 2020 2020 IEEE INTL CONFERENCE ON HIGH PERFORMANCE AND SMART COMPUTING HPSC 2020 AND 2020 IEEE INTL CONFERENCE ON INTELLIGENT DATA AND SECURITY IDS 2020,"PROC - IEEE INTL CONF BIG DATA SECUR CLOUD, BIGDATASECURITY, IEEE INTL CONF HIGH PERFORM SMART COMPUT, HPSC IEEE INTL CONF INTELL DATA SECUR, IDS"
PROCEEDINGS  2020 IEEE 11TH INTERNATIONAL CONFERENCE ON DEPENDABLE SYSTEMS SERVICES AND TECHNOLOGIES DESSERT 2020,"PROC - IEEE INT CONF DEPENDABLE SYST, SERV TECHNOL, DESSERT"
IEEE INTELLIGENT SYSTEMS,IEEE INTELL SYST
2020 IEEE 3RD INTERNATIONAL CONFERENCE ON ELECTRONICS TECHNOLOGY ICET 2020,"IEEE INT CONF ELECTRON TECHNOL, ICET"
INTERNATIONAL JOURNAL OF MANAGEMENT,INT J MANAG
JOURNAL OF ASSET MANAGEMENT,J ASSET MANAGE
COMPUTERS AND SECURITY,COMPUT SECUR
ADDICTION,ADDICTION
FINTECH REGULATION EXPLORING NEW CHALLENGES OF THE CAPITAL MARKETS UNION,FINTECH REGUL: EXPLOR NEW CHALL OF THE CAP MARK UNION
JOURNAL OF SERVICE THEORY AND PRACTICE,JOURNAL OF SERVICE THEORY AND PRACTICE
ICPE 2020  COMPANION OF THE ACMSPEC INTERNATIONAL CONFERENCE ON PERFORMANCE ENGINEERING,ICPE - COMPANION ACM/SPEC INT CONF PERFORM ENG
INTERNATIONAL JOURNAL OF EBUSINESS RESEARCH,INT J E-BUS RES
FRONTIERS OF INFORMATION TECHNOLOGY AND ELECTRONIC ENGINEERING,FRONT INF TECHNOL ELECTR ENG
QUANTITATIVE FINANCE,QUANT FINANC
2020 6TH INTERNATIONAL CONFERENCE ON SIGNAL PROCESSING AND COMMUNICATION ICSC 2020,"INT CONF SIGNAL PROCESS COMMUN, ICSC"
UNIVERSITY OF PENNSYLVANIA LAW REVIEW,UNIV PA LAW REV
JOURNAL OF INDEX INVESTING,J INDEX INVEST
PROCEEDINGS OF THE 7TH INTERNATIONAL CONFERENCE ON COMPUTING FOR SUSTAINABLE GLOBAL DEVELOPMENT INDIACOM 2020,"PROC INT CONF COMPUT SUSTAIN GLOB DEV, INDIACOM"
INTERNATIONAL JOURNAL OF SCIENTIFIC AND TECHNOLOGY RESEARCH,INT J SCI TECHNOL RES
JOURNAL OF INFORMATION AND KNOWLEDGE MANAGEMENT,J INF KNOWL MANAGE
ENTREPRENEURSHIP AND SUSTAINABILITY ISSUES,ENTREP SUSTAIN ISSUES
IIC INTERNATIONAL REVIEW OF INTELLECTUAL PROPERTY AND COMPETITION LAW,IIC INT REV INTELLECT PROP COMPET LAW
JOURNAL OF INDUSTRIAL AND BUSINESS ECONOMICS,J IND BUS ECON
PRODUCTION PLANNING AND CONTROL,PROD PLANN CONTROL
BULETIN EKONOMI MONETER DAN PERBANKAN,BUL EKON MONET PERBANK
AFRICAN JOURNAL OF ECONOMIC AND MANAGEMENT STUDIES,AFR J ECON MANAG STUD
JOURNAL OF FINANCIAL CRIME,J FINANC CRIME
JOURNAL OF SCIENTIFIC AND INDUSTRIAL RESEARCH,J SCI IND RES
INDO  TAIWAN 2ND INTERNATIONAL CONFERENCE ON COMPUTING ANALYTICS AND NETWORKS INDOTAIWAN ICAN 2020  PROCEEDINGS,"INDO - TAIWAN INT CONF COMPUT, ANALYT NETWORKS, INDO-TAIWAN ICAN - PROC"
2020 ADVANCES IN SCIENCE AND ENGINEERING TECHNOLOGY INTERNATIONAL CONFERENCES ASET 2020,"ADV SCI ENG TECHNOL INT CONF, ASET"
