publication_name,iso_source_abbreviation
INTERNATIONAL CONFERENCE ON ADVANCED COMMUNICATION TECHNOLOGY ICACT,INT CONF ADV COMMUN TECHNOL ICACT
INTERNATIONAL JOURNAL OF PSYCHOSOCIAL REHABILITATION,INT J PSYCHOSOC REHAB
QUALITY  ACCESS TO SUCCESS,QUAL ACCESS SUCCESS
CORPORATE GOVERNANCE BINGLEY,CORP GOV
PROCEEDINGS OF THE INTERNATIONAL CONFERENCE ON IT COMMUNICATION AND TECHNOLOGY FOR BETTER LIFE ICT4BL 2019,"PROC INT CONF IT, COMMUN TECHNOL BETTER LIFE, ICT4BL"
JOURNAL OF COMPUTING AND INFORMATION TECHNOLOGY,J COMPT INF TECHNOL
IFACPAPERSONLINE,IFAC-PAPERSONLINE
IC3K 2020  PROCEEDINGS OF THE 12TH INTERNATIONAL JOINT CONFERENCE ON KNOWLEDGE DISCOVERY KNOWLEDGE ENGINEERING AND KNOWLEDGE MANAGEMENT,"IC3K - PROC INT JT CONF KNOWL DISCOV, KNOWL ENG KNOWL MANAG"
ADVANCES IN AFRICAN ECONOMIC SOCIAL AND POLITICAL DEVELOPMENT,ADV AFR ECON SOC POLIT DEV
FORUM SCIENTIAE OECONOMIA,FORUM SCIENTIAE OECONOMIA
BANK I KREDYT,BANK I KREDYT
BANKING ON A REVOLUTION WHY FINANCIAL TECHNOLOGY WONT SAVE A BROKEN SYSTEM,BANK ON A REVOLUTION: WHY FINANCIAL TECHNOLOGY WON'T SAVE A BROKEN SYSTEM
PROCEEDINGS OF THE 15TH INTERNATIONAL CONFERENCE ON BUSINESS INFORMATION SYSTEMS 2020 DEVELOPMENTS OPPORTUNITIES AND CHALLENGES OF DIGITIZATION WIRTSCHAFTSINFORMATIK 2020,"PROC INT CONF BUS INF SYST ""DEV, OPPOR CHALLENGES DIGIT"", WIRTSCHAFTSINFORMATIK"
JOURNAL OF SCIENCE AND TECHNOLOGY POLICY MANAGEMENT,J SCI TECHNOL POLICY MANAGE
JOURNAL OF ECONOMIC COOPERATION AND DEVELOPMENT,J ECON COOP DEV
JOURNAL OF KING ABDULAZIZ UNIVERSITY ISLAMIC ECONOMICS,J KING ABDULAZIZ UNIV ISLAM ECON
RESEARCH FOR RURAL DEVELOPMENT,RES RURAL DEV
INTERNATIONAL MULTIDISCIPLINARY SCIENTIFIC GEOCONFERENCE SURVEYING GEOLOGY AND MINING ECOLOGY MANAGEMENT SGEM,"INT MULTIDISCIPLINARY SCI GEOCONF SURVEYING GEOLOGY MINING ECOLOGY MANAGE, SGEM"
LIBRARY PHILOSOPHY AND PRACTICE,LIBR PHILOS PRACT
COMPLEXITY,COMPLEXITY
IFIP ADVANCES IN INFORMATION AND COMMUNICATION TECHNOLOGY,IFIP ADVANCES IN INFORMATION AND COMMUNICATION TECHNOLOGY
ACADEMY OF STRATEGIC MANAGEMENT JOURNAL,ACAD STRATEG MANAGE J
INTERNATIONAL JOURNAL OF MANAGERIAL FINANCE,INT J MANAGE FINAN
ANNALS OF OPERATIONS RESEARCH,ANN OPER RES
26TH AMERICAS CONFERENCE ON INFORMATION SYSTEMS AMCIS 2020,"AM CONF INF SYST, AMCIS"
LECTURE NOTES IN BUSINESS INFORMATION PROCESSING,LECT NOTES BUS INF PROCESS
PROCEEDINGS OF THE EUROPEAN CONFERENCE ON INNOVATION AND ENTREPRENEURSHIP ECIE,"PROC EUR CONF INNOV ENTREPREN, ECIE"
WORLD REVIEW OF ENTREPRENEURSHIP MANAGEMENT AND SUSTAINABLE DEVELOPMENT,WORLD REV ENTREP MANAGE SUSTAINABLE DEV
JOURNAL OF ASIAN FINANCE ECONOMICS AND BUSINESS,J ASIAN FINANC ECON BUS
JOURNAL OF MANAGEMENT INFORMATION SYSTEMS,J MANAGE INF SYST
FORESIGHT AND STI GOVERNANCE,FORESIGHT STI GOV
INFORMATION TECHNOLOGY AND PEOPLE,INF TECHNOL PEOPLE
INTERNATIONAL JOURNAL OF TECHNOLOGY,INT J TECHNOL
ENTREPRENEURSHIP THEORY AND PRACTICE,ENTREP THEORY PRACT
HOUSING POLICY DEBATE,HOUS POLICY DEBATE
PUBLIC FINANCE QUARTERLY,PUBL FIN QUAR
FOUNDATIONS OF MANAGEMENT,FOUND MANAG
INFORMATION SYSTEMS FRONTIERS,INF SYST FRONT
FOUNDATIONS AND TRENDS IN TECHNOLOGY INFORMATION AND OPERATIONS MANAGEMENT,FOUND TRENDS TECHNOL INF OPER MANAGE
SCIENCE AND INNOVATION,SCI INNO
JOURNAL OF SYSTEM AND MANAGEMENT SCIENCES,J SYST MANAG SCI
INTERNATIONAL POLITICAL ECONOMY SERIES,INT POLIIT ECON SER
INTERDISCIPLINARY JOURNAL OF INFORMATION KNOWLEDGE AND MANAGEMENT,INTERDISCIP J INF KNOWL MANAGE
REVIEW OF CONTEMPORARY PHILOSOPHY,REV CONTEMP PHILOS
THE TECHNOLOGICAL REVOLUTION IN FINANCIAL SERVICES HOW BANKS FINTECHS AND CUSTOMERS WIN TOGETHER,"THE TECHNOLOGICAL REVOLUTION IN FINANCIAL SERVICES: HOW BANKS, FINTECHS, AND CUSTOMERS WIN TOGETHER"
ACADEMY OF ENTREPRENEURSHIP JOURNAL,ACAD ENTREP J
ASIA POLICY,ASIA POLICY
TRANSITION STUDIES REVIEW,TRANSIT STUD REV
JOURNAL OF CRITICAL REVIEWS,J CRIT REV
PERSPECTIVES IN LAW BUSINESS AND INNOVATION,PERSPECT LAW BUS INNOV
PALGRAVE STUDIES IN SUSTAINABLE BUSINESS IN ASSOCIATION WITH FUTURE EARTH,PALGRAVE STUD SUSTAIN BUS ASSOC FUTURE EARTH
PROCEEDINGS OF THE 24TH PACIFIC ASIA CONFERENCE ON INFORMATION SYSTEMS INFORMATION SYSTEMS IS FOR THE FUTURE PACIS 2020,"PROC PAC ASIA CONF INF SYST: INF SYST (IS) FUTURE, PACIS"
MOVING FROM THE MILLENNIUM TO THE SUSTAINABLE DEVELOPMENT GOALS LESSONS AND RECOMMENDATIONS,MOV FROM THE MILLENNIUM TO THE SUSTAINABLE DEVELOPMENT GOALS: LESSONS AND RECOMMENDATIONS
PERIODICALS OF ENGINEERING AND NATURAL SCIENCES,PERIOD ENG NAT SCI
MAKING MONEY THE HISTORY AND FUTURE OF SOCIETYS MOST IMPORTANT TECHNOLOGY,MAKING MONEY: THE HISTORY AND FUTURE OF SOCIETY'S MOST IMPORTANT TECHNOLOGY
EJOURNAL OF TAX RESEARCH,EJOURNAL TAX RES
JOURNAL OF FINANCIAL COUNSELING AND PLANNING,J FINANC COUNS PLANN
COGENT BUSINESS AND MANAGEMENT,COGENT BUS MANAG
JOURNAL OF ENTERPRISE INFORMATION MANAGEMENT,J ENTERP INF MANAGE
SINGAPORE JOURNAL OF LEGAL STUDIES,SINGAP J LEG STUD
REVIEW OF INTERNATIONAL POLITICAL ECONOMY,REV INT POLIT ECON
AFRICAN JOURNAL OF SCIENCE TECHNOLOGY INNOVATION AND DEVELOPMENT,AFR J SCI TECHNOL INNOV DEV
INTERNATIONAL JOURNAL OF ECONOMICS AND BUSINESS ADMINISTRATION,INT J ECON BUS ADM
INTERNATIONAL JOURNAL ON EMERGING TECHNOLOGIES,INT J EMERG TECHNOL
INTERNATIONAL JOURNAL OF INNOVATION CREATIVITY AND CHANGE,INT J INNOV CREAT CHANGE
INTERNATIONAL JOURNAL OF ADVANCED TRENDS IN COMPUTER SCIENCE AND ENGINEERING,INT J ADV TRENDS COMPUT SCI ENG
INTERNATIONAL JOURNAL OF WIRELESS AND MOBILE COMPUTING,INT J WIRELESS MOBILE COMPUT
WSEAS TRANSACTIONS ON BUSINESS AND ECONOMICS,WSEAS TRANS BUSI ECON
PROCEEDINGS OF INTERNATIONAL CONFERENCE ON COMPUTATION AUTOMATION AND KNOWLEDGE MANAGEMENT ICCAKM 2020,"PROC INT CONF COMPUT, AUTOM KNOWL MANAG, ICCAKM"
LECTURE NOTES ON DATA ENGINEERING AND COMMUNICATIONS TECHNOLOGIES,LECTURE NOTES DATA ENG COMMUN TECH
INTERNATIONAL JOURNAL OF BUSINESS AND SYSTEMS RESEARCH,INT J BUS SYST RES
JOURNAL OF ADVANCED RESEARCH IN DYNAMICAL AND CONTROL SYSTEMS,J ADV RES DYN CONTROL SYST
LECTURE NOTES OF THE INSTITUTE FOR COMPUTER SCIENCES SOCIALINFORMATICS AND TELECOMMUNICATIONS ENGINEERING LNICST,LECT NOTES INST COMPUT SCI SOC INFORMATICS TELECOMMUN ENG
LECTURE NOTES IN INFORMATION SYSTEMS AND ORGANISATION,LECT NOTES INF SYS ORGAN
SAGE OPEN,SAGE OPEN
FORUM FOR SOCIAL ECONOMICS,FORUM SOC ECON
SMART INNOVATION SYSTEMS AND TECHNOLOGIES,SMART INNOV SYST TECHNOL
REVISTA CHILENA DE DERECHO Y TECNOLOGIA,REV CHIL DERECHO TECNOL
FORBES,FORBES
EUROPEAN PLANNING STUDIES,EUR PLANN STUD
UNIFORM LAW REVIEW,UNIF LAW REV
PROCEEDINGS  18TH IEEE INTERNATIONAL CONFERENCE ON MACHINE LEARNING AND APPLICATIONS ICMLA 2019,"PROC - IEEE INT CONF MACH LEARN APPL, ICMLA"
POLITICS AND SOCIETY,POLIT SOC
2019 IEEE GLOBAL COMMUNICATIONS CONFERENCE GLOBECOM 2019  PROCEEDINGS,"IEEE GLOB COMMUN CONF, GLOBECOM - PROC"
CURRENT OPINION IN ENVIRONMENTAL SUSTAINABILITY,CURR OPIN ENVIRON SUSTAINABILITY
INTERNATIONAL JOURNAL OF ENVIRONMENTAL RESEARCH AND PUBLIC HEALTH,INT J ENVIRON RES PUBLIC HEALTH
PROCEEDING OF 2019 INTERNATIONAL CONFERENCE ON DIGITIZATION LANDSCAPING ARTIFICIAL INTELLIGENCE ICD 2019,"PROCEEDING INT CONF DIGIT: LANDSCAPING ARTIF INTELL, ICD"
2019 7TH INTERNATIONAL CONFERENCE ON CYBER AND IT SERVICE MANAGEMENT CITSM 2019,"INT CONF CYBER IT SERV MANAG, CITSM"
INTERNATIONAL CONFERENCE ON ICT AND KNOWLEDGE ENGINEERING,INT CONF ICT KNOWL ENG
2019 INTERNATIONAL CONFERENCE ON ELECTRICAL AND COMPUTING TECHNOLOGIES AND APPLICATIONS ICECTA 2019,"INT CONF ELECTR COMPUT TECHNOL APPL, ICECTA"
COMMUNICATIONS OF THE ACM,COMMUN ACM
INTERNATIONAL FINANCE REVIEW,INT FINANC REV
FINTECH AND ISLAMIC FINANCE DIGITALIZATION DEVELOPMENT AND DISRUPTION,"FINTECH AND ISLAM FINANC: DIGIT, DEV AND DISRUPT"
COMPETITION LAW JOURNAL,COMPET LAW J
PROCEEDINGS OF IEEE INTERNATIONAL CONFERENCE ON SIGNAL PROCESSINGCOMPUTING AND CONTROL,"PROC IEEE INT CONF SIGNAL PROCESS, COMPUT CONTROL, ISPCC"
INTERNATIONAL JOURNAL OF INNOVATIVE TECHNOLOGY AND EXPLORING ENGINEERING,INT J INNOV TECHNOL EXPLOR ENG
IMPACT OF FINANCIAL TECHNOLOGY FINTECH ON ISLAMIC FINANCE AND FINANCIAL STABILITY,IMPACT OF FINANC TECHNOL (FINTECH) ON ISLAM FINANC AND FINANC STAB
SOCIETY AND ECONOMY,SOC ECON
2019 INTERNATIONAL CONFERENCE ON CYBERSECURITY ICOCSEC 2019,"INT CONF CYBERSECUR, ICOCSEC"
UBMK 2019  PROCEEDINGS 4TH INTERNATIONAL CONFERENCE ON COMPUTER SCIENCE AND ENGINEERING,"UBMK - PROC, INT CONF COMPUT SCI ENG"
PROCEEDINGS  2019 ACMIEEE 22ND INTERNATIONAL CONFERENCE ON MODEL DRIVEN ENGINEERING LANGUAGES AND SYSTEMS MODELS 2019,"PROC - ACM/IEEE INT CONF MODEL DRIVEN ENG LANG SYST, MODELS"
MANAGEMENT AND MARKETING,MANAGE MARK
INTERNATIONAL JOURNAL OF RECENT TECHNOLOGY AND ENGINEERING,INT J RECENT TECHNOL ENG
HANDBOOK OF RESEARCH ON STRATEGIC FIT AND DESIGN IN BUSINESS ECOSYSTEMS,HANDB OF RES ON STRATEG FIT AND DES IN BUS ECOSYST
ESECFSE 2019  PROCEEDINGS OF THE 2019 27TH ACM JOINT MEETING EUROPEAN SOFTWARE ENGINEERING CONFERENCE AND SYMPOSIUM ON THE FOUNDATIONS OF SOFTWARE ENGINEERING,ESEC/FSE - PROC ACM JT MEET EUR SOFTW ENG CONF SYMP FOUND SOFTW ENG
PROCEEDINGS  2019 IEEE SMARTWORLD UBIQUITOUS INTELLIGENCE AND COMPUTING ADVANCED AND TRUSTED COMPUTING SCALABLE COMPUTING AND COMMUNICATIONS INTERNET OF PEOPLE AND SMART CITY INNOVATION SMARTWORLDUICATCSCALCOMIOPSCI 2019,"PROC - IEEE SMARTWORLD, UBIQUITOUS INTELL COMPUT, ADV TRUSTED COMPUT, SCALABLE COMPUT COMMUN, INTERNET PEOPLE SMART CITY INNOV, SMARTWORLD/UIC/ATC/SCALCOM/IOP/SCI"
PROCEEDINGS OF 2019 INTERNATIONAL CONFERENCE ON INFORMATION MANAGEMENT AND TECHNOLOGY ICIMTECH 2019,"PROC INT CONF INF MANAG TECHNOL, ICIMTECH"
NEW MEDIA AND SOCIETY,NEW MEDIA AND SOCIETY
STATES INTERNATIONAL ORGANIZATIONS AND STRATEGIC PARTNERSHIPS,"STATES, INT ORGAN AND STRATEG PARTNERSH"
RESEARCH TECHNOLOGY MANAGEMENT,RES TECHNOL MANAGE
AFRICA JOURNAL OF MANAGEMENT,AFRICA J MANAG
PROCEEDINGS  2019 8TH INTERNATIONAL CONGRESS ON ADVANCED APPLIED INFORMATICS IIAIAAI 2019,"PROC - INT CONGR ADV APPL INF, IIAI-AAI"
PROCEEDINGS  2019 IEEE WORLD CONGRESS ON SERVICES SERVICES 2019,"PROC - IEEE WORLD CONGR SERV, SERVICES"
ERA FORUM,ERA FORUM
INTERNATIONAL JOURNAL OF HUMANCOMPUTER INTERACTION,INT J HUM-COMPUT INTERACT
EXTENDING FINANCIAL INCLUSION IN AFRICA,EXTENDING FINANC INCL IN AFR
JOURNAL OF FINANCE AND DATA SCIENCE,J FINANCE DATA SCI
YALE JOURNAL ON REGULATION,YALE J REGUL
INTERNATIONAL JOURNAL OF ENGINEERING AND ADVANCED TECHNOLOGY,INT J ENG ADV TECHNOL
PROCEEDINGS  2019 IEEE INTERNATIONAL CONFERENCE ON ARTIFICIAL INTELLIGENCE TESTING AITEST 2019,"PROC - IEEE INT CONF ARTIF INTELL TEST, AITEST"
INTERNATIONAL JOURNAL OF INDUSTRIAL ORGANIZATION,INT J IND ORGANIZ
COMPUTER STANDARDS AND INTERFACES,COMPUT STAND INTERFACES
JOURNAL OF RETAILING AND CONSUMER SERVICES,J RETAIL CONSUM SERV
JOURNAL OF BUSINESSTOBUSINESS MARKETING,J BUS BUS MARK
2019 INTERNATIONAL CONFERENCE ON AUTOMATION COMPUTATIONAL AND TECHNOLOGY MANAGEMENT ICACTM 2019,"INT CONF AUTOM, COMPUT TECHNOL MANAG, ICACTM"
SOCIAL STUDIES OF SCIENCE,SOC STUD SCI
INTERNATIONAL JOURNAL OF SERVICE SCIENCE MANAGEMENT ENGINEERING AND TECHNOLOGY,INT J SERV SCI MANAG ENG TECHNOL
CRYPTOCURRENCY IN ALL ASPECTS,CRYPTOCURRENCY IN ALL ASP
RISK MANAGEMENT,RISK MANAGE
PROCEEDINGS  2018 INTERNATIONAL CONFERENCE ON COMPUTING ELECTRONICS AND COMMUNICATIONS ENGINEERING ICCECE 2018,"PROC - INT CONF COMPUT, ELECTRON COMMUN ENG, ICCECE"
SYMMETRY,SYMMETRY
ASIA PACIFIC JOURNAL OF INFORMATION SYSTEMS,ASIA PAC J INF SYST
JOURNAL OF STRATEGIC INFORMATION SYSTEMS,J STRATEGIC INFORM SYST
NTT TECHNICAL REVIEW,NTT TECH REV
ASIA LIFE SCIENCES,ASIA LIFE SCI
2018 INTERNATIONAL SCIENTIFICPRACTICAL CONFERENCE ON PROBLEMS OF INFOCOMMUNICATIONS SCIENCE AND TECHNOLOGY PIC S AND T 2018  PROCEEDINGS,"INT SCI-PRACT CONF PROBL INFOCOMMUNICATIONS SCI TECHNOL, PIC S T - PROC"
1ST 2018 INDONESIAN ASSOCIATION FOR PATTERN RECOGNITION INTERNATIONAL CONFERENCE INAPR 2018  PROCEEDINGS,"INDONES ASSOC PATTERN RECOGNIT INT CONF, INAPR - PROC"
VENTURE CAPITAL,VENTURE CAP
40TH INTERNATIONAL CONFERENCE ON INFORMATION SYSTEMS ICIS 2019,"INT CONF INF SYST, ICIS"
FINANCE THEORY AND PRACTICE,FIN THEORY PRACT
THE DIGITAL BANKING REVOLUTION HOW FINTECH COMPANIES ARE TRANSFORMING THE RETAIL BANKING INDUSTRY THROUGH DISRUPTIVE FINANCIAL INNOVATION,THE DIGITAL BANK REVOLUTION: HOW FINTECH CO ARE TRANSFORMING THE RETAIL BANK INDUSTRY THROUGH DISRUPTIVE FINANCIAL INNOVATION
SEVERAL DIMENSIONS OF INNOVATION TECHNOLOGY AND INDUSTRY 40,"SEVERAL DIMENSIONS OF INNOVATION, TECHNOLOGY AND INDUSTRY 40"
ADVANCES IN SCIENCE TECHNOLOGY AND INNOVATION,ADV SCI TECH INNO
PROCEEDINGS OF THE 23RD PACIFIC ASIA CONFERENCE ON INFORMATION SYSTEMS SECURE ICT PLATFORM FOR THE 4TH INDUSTRIAL REVOLUTION PACIS 2019,"PROC PAC ASIA CONF INF SYST: SECUR ICT PLATF IND REVOL, PACIS"
FINTECH AND DATA PRIVACY IN GERMANY AN EMPIRICAL ANALYSIS WITH POLICY RECOMMENDATIONS,FINTECH AND DATA PRIV IN GERMANY: AN EMPIR ANALYSIS WITH POLICY RECOMMENDATIONS
25TH AMERICAS CONFERENCE ON INFORMATION SYSTEMS AMCIS 2019,"AM CONF INF SYST, AMCIS"
MANAGING TECHNOLOGY FOR INCLUSIVE AND SUSTAINABLE GROWTH  28TH INTERNATIONAL CONFERENCE FOR THE INTERNATIONAL ASSOCIATION OF MANAGEMENT OF TECHNOLOGY IAMOT 2019,"MANAG TECHNOL INCL SUSTAIN GROWTH - INT CONF INT ASSOC MANAG TECHNOL, IAMOT"
AFRICAN JOURNAL OF BUSINESS AND ECONOMIC RESEARCH,AFRICAN J BUS ECON RES
PROCEEDINGS OF THE INTERNATIONAL ASTRONAUTICAL CONGRESS IAC,"PROC INT ASTRONAUT CONGR, IAC"
INDIAN JOURNAL OF ECONOMICS AND BUSINESS,INDIAN J ECON BUS
INTERNATIONAL JOURNAL OF INFORMATION SYSTEMS AND CHANGE MANAGEMENT,INT J INF SYST CHANGE MANGE
ALSHAJARAH,AL-SHAJARAH
INTELLECTUAL DISCOURSE,INTELLECT DISCOURSE
PUBLIC SECTOR ECONOMICS,PUBLIC SECT ECON
INTEREULAWEAST,INTEREULAWEAST
CRYPTO UNCOVERED THE EVOLUTION OF BITCOIN AND THE CRYPTO CURRENCY MARKETPLACE,CRYPTO UNCOVERED: THE EVOLUTION OF BITCOIN AND THE CRYPTO CURR MARKETPL
PROCEEDINGS OF THE 33RD INTERNATIONAL BUSINESS INFORMATION MANAGEMENT ASSOCIATION CONFERENCE IBIMA 2019 EDUCATION EXCELLENCE AND INNOVATION MANAGEMENT THROUGH VISION 2020,"PROC INT BUS INF MANAG ASSOC CONF, IBIMA: EDUC EXCELL INNOV MANAG VIS"
CREDIT AND CAPITAL MARKETS,CREDIT CAP MARK
MEZHDUNARODNYE PROTSESSY,MEZHDUNAR PROTSESSY
VIDE TEHNOLOGIJA RESURSI  ENVIRONMENT TECHNOLOGY RESOURCES,"VIDE TEHNOLOGIJA RESURSI - ENVIRON, TECHNOL RSRC"
INTERNATIONAL ORGANISATIONS RESEARCH JOURNAL,INT ORGAN RES J
JOURNAL OF DISTRIBUTION SCIENCE,J DISTRIBUTION SCIENCE
AFRICAN JOURNAL OF HOSPITALITY TOURISM AND LEISURE,AFR J HOSP TOUR LEIS
INTERNATIONAL JOURNAL ON ADVANCED SCIENCE ENGINEERING AND INFORMATION TECHNOLOGY,INT J ADV SCI ENG INF TECHNOL
VOPROSY EKONOMIKI,VOPR EKON
INTERNATIONAL JOURNAL OF ADVANCED COMPUTER SCIENCE AND APPLICATIONS,INTL J ADV COMPUT SCI APPL
JOURNAL OF PROMOTION MANAGEMENT,J PROMOT MANAGE
FRONTIERS IN PSYCHOLOGY,FRONT PSYCHOL
ISLAMIC FINANCE RISKSHARING AND MACROECONOMIC STABILITY,"ISLAMIC FINANCE, RISK-SHARING AND MACROECONOMIC STAB"
GEORGETOWN LAW JOURNAL,GEORGET LAW J
INTERNATIONAL JOURNAL OF TECHNOLOGY POLICY AND MANAGEMENT,INT J TECHNOL POLICY MANAGE
ENERGY PROCEDIA,ENERGY PROCEDIA
IEICE TRANSACTIONS ON FUNDAMENTALS OF ELECTRONICS COMMUNICATIONS AND COMPUTER SCIENCES,IEICE TRANS FUND ELECTRON COMMUN COMPUT SCI
IEEE TRANSACTIONS ON VISUALIZATION AND COMPUTER GRAPHICS,IEEE TRANS VISUAL COMPUT GRAPHICS
JOURNAL OF CORPORATE LAW STUDIES,J CORP LAW STUD
CONTEMPORARY ECONOMIC POLICY,CONTEMP ECON POLICY
CONTEMPORARY ECONOMICS,CONTEMP ECON
FIIB BUSINESS REVIEW,FIIB BUS REV
RAGION PRATICA,RAGION PRAT
INTERNATIONAL JOURNAL OF MECHANICAL ENGINEERING AND TECHNOLOGY,INT J MECH ENG TECHNOL
JOURNAL OF RISK MANAGEMENT IN FINANCIAL INSTITUTIONS,J RISK MANG FINANCIAL INST
HUMANCENTRIC COMPUTING AND INFORMATION SCIENCES,HUM-CENTRIC COMPUT INF SCI
ACCOUNTING AND FINANCE,ACCOUNT FINANC
BORSA ISTANBUL REVIEW,BORSA ISTANB REV
JOURNAL OF ALTERNATIVE INVESTMENTS,J ALTERN INVESTM
JOURNAL OF INFORMATION TECHNOLOGY,J INF TECHNOL
PROCEEDINGS OF 2018 11TH INTERNATIONAL CONFERENCE QUOTMANAGEMENT OF LARGESCALE SYSTEM DEVELOPMENTQUOT MLSD 2018,"PROC INT CONF ""MANAG LARGE-SCALE SYST DEV"", MLSD"
PROCEEDINGS OF 2018 INTERNATIONAL CONFERENCE ON INFORMATION MANAGEMENT AND TECHNOLOGY ICIMTECH 2018,"PROC INT CONF INF MANAG TECHNOL, ICIMTECH"
EXPLORING THE FUTURE OF RUSSIAS ECONOMY AND MARKETS TOWARDS SUSTAINABLE ECONOMIC DEVELOPMENT,EXPLOR THE FUTURE OF RUSS ECON AND MARK: TOWARDS SUSTAIN ECON DEV
DIALOGUES IN HUMAN GEOGRAPHY,DIALOGUES HUM GEOGR
ESECFSE 2018  PROCEEDINGS OF THE 2018 26TH ACM JOINT MEETING ON EUROPEAN SOFTWARE ENGINEERING CONFERENCE AND SYMPOSIUM ON THE FOUNDATIONS OF SOFTWARE ENGINEERING,ESEC/FSE - PROC ACM JT MEET EUR SOFTW ENG CONF SYMP FOUND SOFTW ENG
PROCEEDINGS OF THE 2018 IEEEACM INTERNATIONAL CONFERENCE ON ADVANCES IN SOCIAL NETWORKS ANALYSIS AND MINING ASONAM 2018,"PROC IEEE/ACM INT CONF ADV SOC NETWORKS ANAL MINING, ASONAM"
PICMET 2018  PORTLAND INTERNATIONAL CONFERENCE ON MANAGEMENT OF ENGINEERING AND TECHNOLOGY MANAGING TECHNOLOGICAL ENTREPRENEURSHIP THE ENGINE FOR ECONOMIC GROWTH PROCEEDINGS,"PICMET - PORTLAND INT CONF MANAG ENG TECHNOL: MANAG TECHNOL ENTREP: ENGINE ECON GROWTH, PROC"
TEMSISIE 2018  1ST ANNUAL INTERNATIONAL SYMPOSIUM ON INNOVATION AND ENTREPRENEURSHIP OF THE IEEE TECHNOLOGY AND ENGINEERING MANAGEMENT SOCIETY,TEMS-ISIE - ANNU INT SYMP INNOV ENTREP IEEE TECHNOL ENG MANAG SOC
ECONOMIC AFFAIRS,ECON AFF
13TH INTERNATIONAL CONFERENCE ON COMPUTER SCIENCE AND EDUCATION ICCSE 2018,"INT CONF COMPUT SCI EDUC, ICCSE"
ECONOMIST UNITED KINGDOM,ECONOMIST
INFORMATION AND COMMUNICATIONS TECHNOLOGY LAW,INF COMMUN TECHNOL LAW
ONLINE JOURNAL MODELLING THE NEW EUROPE,ONLINE J MODEL NEW EUR
GEORGE WASHINGTON LAW REVIEW,GEORGE WASHINGTON LAW REV
CORPORATE GOVERNANCE AN INTERNATIONAL REVIEW,CORP GOV: INT REV
QUANTITATIVE MARKETING AND ECONOMICS,QUANT MARK ECON
INTERNATIONAL ENTREPRENEURSHIP AND MANAGEMENT JOURNAL,INT ENTREP MANAGE J
PROCEEDING  2018 20TH IEEE INTERNATIONAL CONFERENCE ON BUSINESS INFORMATICS CBI 2018,"PROCEEDING - IEEE INT CONF BUS INFORMATICS, CBI"
INTERNATIONAL FINANCIAL CENTRES AFTER THE GLOBAL FINANCIAL CRISIS AND BREXIT,INT FINANC CENT AFTER THE GLOB FINANC CRISIS AND BREXIT
2018 IEEE INTERNATIONAL CONFERENCE ON ENGINEERING TECHNOLOGY AND INNOVATION ICEITMC 2018  PROCEEDINGS,"IEEE INT CONF ENG, TECHNOL INNOV, ICE/ITMC - PROC"
ELECTRONIC MARKETS,ELECTRON MARK
CUTTER BUSINESS TECHNOLOGY JOURNAL,CUTTER BUSINESS TECHNOLOGY JOURNAL
JOURNAL OF REVIEWS ON GLOBAL ECONOMICS,J REV GLOB ECON
NEW COOPERATIVE BANKING IN EUROPE STRATEGIES FOR ADAPTING THE BUSINESS MODEL POST CRISIS,NEW COOPERATIVE BANK IN EUROPE: STRATEGIES FOR ADAPTING THE BUS MODEL POST CRISIS
EUROPEAN RESEARCH STUDIES JOURNAL,EUR RES STUD
PROCEEDINGS OF THE 32ND INTERNATIONAL BUSINESS INFORMATION MANAGEMENT ASSOCIATION CONFERENCE IBIMA 2018  VISION 2020 SUSTAINABLE ECONOMIC DEVELOPMENT AND APPLICATION OF INNOVATION MANAGEMENT FROM REGIONAL EXPANSION TO GLOBAL GROWTH,"PROC INT BUS INF MANAG ASSOC CONF, IBIMA - VIS: SUSTAIN ECON DEV APPL INNOV MANAG REG EXPANS GLOB GROWTH"
INTERNATIONAL CONFERENCE ON INFORMATION SYSTEMS 2018 ICIS 2018,"INT CONF INF SYST, ICIS"
INNOVATIVE MARKETING,INNOV MARK
26TH EUROPEAN CONFERENCE ON INFORMATION SYSTEMS BEYOND DIGITIZATION  FACETS OF SOCIOTECHNICAL CHANGE ECIS 2018,"EUR CONF INF SYST: BEYOND DIGITIZATION - FACETS SOCIO-TECH CHANGE, ECIS"
PROCEEDINGS OF THE 31ST INTERNATIONAL BUSINESS INFORMATION MANAGEMENT ASSOCIATION CONFERENCE IBIMA 2018 INNOVATION MANAGEMENT AND EDUCATION EXCELLENCE THROUGH VISION 2020,"PROC INT BUS INF MANAG ASSOC CONF, IBIMA: INNOV MANAG EDUC EXCELL VIS"
JOURNAL OF SOCIAL SCIENCES RESEARCH,J SOC SCI RES
INCLUSIVE FINTECH BLOCKCHAIN CRYPTOCURRENCY AND ICO,"INCLUSIVE FINTECH: BLOCKCHAIN, CRYPTOCURRENCY AND ICO"
LAW AND ECONOMICS YEARLY REVIEW,LAW ECON YRLY REV
SOUTH AFRICAN JOURNAL OF ECONOMIC AND MANAGEMENT SCIENCES,S AFR J ECON MANAGE SCI
JOURNAL OF INTERNET TECHNOLOGY,J INTERNET TECHNOL
HANDBOOK OF BLOCKCHAIN DIGITAL FINANCE AND INCLUSION,"HANDB OF BLOCKCHAIN, DIGIT FINANC, AND INCL"
HANDBOOK OF BLOCKCHAIN DIGITAL FINANCE AND INCLUSION VOLUME 1 CRYPTOCURRENCY FINTECH INSURTECH AND REGULATION,"HANDB OF BLOCKCHAIN, DIGIT FINANC, AND INCL, VOL 1: CRYPTOCURR, FINTECH, INSURTECH, AND REGUL"
AMERICAS CONFERENCE ON INFORMATION SYSTEMS 2018 DIGITAL DISRUPTION AMCIS 2018,"AM CONF INFO SYST: DIGIT DISRUPT, AMCIS"
RUSSIAN JOURNAL OF CRIMINOLOGY,RUS J OF CRIM
MKWI 2018  MULTIKONFERENZ WIRTSCHAFTSINFORMATIK,MKWI - MULTIKONFERENZ WIRTSCHAFTSINFORMATIK
FINTECH AND THE REMAKING OF FINANCIAL INSTITUTIONS,FINTECH AND THE REMAKING OF FINANCIAL INSTITUTIONS
INTERNATIONAL JOURNAL OF ENGINEERING AND TECHNOLOGYUAE,INT J ENG TECHNOL
SPRINGER PROCEEDINGS IN MATHEMATICS AND STATISTICS,SPRINGER PROC MATH STAT
JOURNAL OF HIGH TECHNOLOGY MANAGEMENT RESEARCH,J HIGH TECHNOL MANAGE RES
JOURNAL OF ENGINEERING AND APPLIED SCIENCES,J ENG APPL SCI
UCLA LAW REVIEW,UCLA LAW REV
INFORMATION AND COMPUTER SECURITY,INF COMPUT SECURITY
JOURNAL OF RISK FINANCE,J RISK FINANC
ICIC EXPRESS LETTERS PART B APPLICATIONS,ICIC EXPRESS LETT PART B APPL
BUSINESS HORIZONS,BUS HORIZ
TURKISH ONLINE JOURNAL OF EDUCATIONAL TECHNOLOGY,TURK ONL J EDU TECH
JOURNAL OF PRIVATE EQUITY,J PRIV EQUITY
ECONOMICS LETTERS,ECON LETT
IEEE POTENTIALS,IEEE POTENTIALS
JOURNAL OF COMPUTER VIROLOGY AND HACKING TECHNIQUES,J COMPUT VIROL HACKING TECH
ADVANCED SCIENCE LETTERS,ADV SCI LETT
INTERNATIONAL JOURNAL OF MACHINE LEARNING AND COMPUTING,INT J MACH LEARN COMPUT
DIGITAL MARKETPLACES UNLEASHED,DIGIT MARKETPLACES UNLEASHED
PROCEEDINGS OF THE ACMIEEE JOINT CONFERENCE ON DIGITAL LIBRARIES,PROC ACM IEEE JOINT CONF DIGIT LIBR
LAW INNOVATION AND TECHNOLOGY,LAW INNOV TECHNOL
PROCEEDINGS  2017 4TH INTERNATIONAL CONFERENCE ON INFORMATION TECHNOLOGY COMPUTER AND ELECTRICAL ENGINEERING ICITACEE 2017,"PROC - INT CONF INF TECHNOL, COMPUT, ELECTR ENG, ICITACEE"
NEC TECHNICAL JOURNAL,NEC TECH J
INTELLIGENT SYSTEMS IN ACCOUNTING FINANCE AND MANAGEMENT,INTELL SYST ACCOUNT FINANCE MANAG
ECONOMIC AND POLITICAL WEEKLY,ECON POLIT WKLY
PROCEEDINGS OF 2016 IEEE ADVANCED INFORMATION MANAGEMENT COMMUNICATES ELECTRONIC AND AUTOMATION CONTROL CONFERENCE IMCEC 2016,"PROC IEEE ADV INF MANAG, COMMUN, ELECTRON AUTOM CONTROL CONF, IMCEC"
KSII TRANSACTIONS ON INTERNET AND INFORMATION SYSTEMS,KSII TRANS INTERNET INF SYST
JUSLETTER IT,JUSLETTER IT
INTERNATIONAL DATA PRIVACY LAW,INT DATA PRIVACY LAW
BUSINESS AND INFORMATION SYSTEMS ENGINEERING,BUSIN INFO SYS ENG
LAW AND FINANCIAL MARKETS REVIEW,LAW FINANC MARK REV
PROCEEDINGS OF THE 28TH AUSTRALASIAN CONFERENCE ON INFORMATION SYSTEMS ACIS 2017,"PROC AUSTRALAS CONF INF SYST, ACIS"
PROCEEDINGS OF THE INTERNATIONAL CONFERENCE ON ELECTRONIC BUSINESS ICEB,PROC INT CONF ELECTRON BUS (ICEB)
INFORMATION JAPAN,INFORMATION
FINTECH IN GERMANY,FINTECH IN GER
MASARYK UNIVERSITY JOURNAL OF LAW AND TECHNOLOGY,MASARYK UNIV J LAW TECHNOL
NORTHWESTERN JOURNAL OF INTERNATIONAL LAW AND BUSINESS,NORTHWEST J INTL LAW BUS
EQUITY MARKETS IN TRANSITION THE VALUE CHAIN PRICE DISCOVERY REGULATION AND BEYOND,"EQUITY MARKETS IN TRANSITION: THE VALUE CHAIN, PRICE DISCOVERY, REGULATION, AND BEYOND"
IT PROFESSIONAL,IT PROF
PROCEEDINGS OF THE 2016 IEEEACM INTERNATIONAL CONFERENCE ON ADVANCES IN SOCIAL NETWORKS ANALYSIS AND MINING ASONAM 2016,"PROC IEEE/ACM INT CONF ADV SOC NETW ANAL MIN, ASONAM"
CHINA ECONOMIC JOURNAL,CHINA ECON J
HITACHI REVIEW,HITACHI REV
PROCEEDINGS OF THE 2015 7TH INTERNATIONAL CONFERENCE OF SOFT COMPUTING AND PATTERN RECOGNITION SOCPAR 2015,"PROC INT CONF SOFT COMPUT PATTERN RECOGNIT, SOCPAR"
INTERNATIONAL JOURNAL OF APPLIED ENGINEERING RESEARCH,INT J APPL ENG RES
JOURNAL OF INNOVATION MANAGEMENT,J INNOV MANAG
2016 INTERNATIONAL CONFERENCE ON INFORMATION SYSTEMS ICIS 2016,"INT CONF INF SYST, ICIS"
INTERNATIONAL JOURNAL OF SECURITY AND ITS APPLICATIONS,INT J SECUR APPL
NEW ECONOMIC WINDOWS,NEW ECON WINDOWS
CONTEMPORARY STUDIES IN ECONOMIC AND FINANCIAL ANALYSIS,CONTEMP STUD ECON FINANC ANAL
LONDON BUSINESS SCHOOL REVIEW,LONDON BUS SCH REV
ECOLOGY ENVIRONMENT AND CONSERVATION,ECOL ENVIRON CONSERV
FORTUNE,FORTUNE
VANDERBILT LAW REVIEW,VANDERBILT LAW REV
JOURNAL OF NETWORK AND COMPUTER APPLICATIONS,J NETW COMPUT APPL
JOURNAL OF INVESTMENT MANAGEMENT,J INVEST MANAG
REVIEW OF BUSINESS,REV BUS
JOURNAL OF INVESTING,J INVEST
JURIDICAS CUC,JURID CUC
QUALITYACCESS TO SUCCESS,QUAL-ACCESS SUCCESS
JASSATHE FINSIA JOURNAL OF APPLIED FINANCE,JASSA
ENTREPRENEURSHIP AND SUSTAINABILITY ISSUES,ENTREP SUSTAIN ISS
IIUM LAW JOURNAL,IIUM LAW J
