Authors,Author(s) ID,Title,Year,Source title,Volume,Issue,Art. No.,Page start,Page end,Page count,Cited by,DOI,Link,Affiliations,Authors with affiliations,Abstract,Author Keywords,Index Keywords,Correspondence Address,ISSN,ISBN,CODEN,Abbreviated Source Title,Document Type,Publication Stage,Open Access,Source
"Nurlaily F., Aini E.K., Asmoro P.S.","57260807000;57260588200;57260915900;","Understanding the fintech continuance intention of Idonesian users: The moderating effect of gender",2021,"Business: Theory and Practice","22","2",,"290","298",,2,"10.3846/btp.2021.13880","https://www.scopus.com/inward/record.uri?eid=2-s2.0-85115002975&doi=10.3846%2fbtp.2021.13880&partnerID=40&md5=05e3bea0005103ac11ade3136583e14d","Faculty of Administrative Science, Universitas Brawijaya, Malang, Indonesia","Nurlaily, F., Faculty of Administrative Science, Universitas Brawijaya, Malang, Indonesia; Aini, E.K., Faculty of Administrative Science, Universitas Brawijaya, Malang, Indonesia; Asmoro, P.S., Faculty of Administrative Science, Universitas Brawijaya, Malang, Indonesia","This research attempt to analyze risk and benefit factors as well as their influence on sustainability intention of FinTech. We elucidate the Planned Behavior Theory by including the perceived benefits and perceived risk variables to investigate its effect on intention to continue using FinTech. We also examined whether or not men and women are affected differently by the benefits and risk they perceive when using FinTech. Data were collected through online surveys, then being analyzed using GSCA. The results reveal perceived benefits are affected significantly by the convenience aspect and deliver a significant effect on FinTech continuance intention. The risk perceived by FinTech users is affected the most by legal risk. This study proves that gender is able to moderate the perceived risk influence on the intention to continue using FinTech, especially in the female user group. © 2021 The Author(s).","FinTech continuance intention; Gender; Perceived benefit; Perceived risk; Theory of planned behavior",,"Nurlaily, F.; Faculty of Administrative Science, Indonesia; email: ferinanurlaily@ub.ac.id",16480627,,,"Bus. Theory Pract.",Article,"Final","All Open Access, Gold",Scopus
"Charaia V., Chochia A., Lashkhi M.","57201492749;56667586900;57205150131;","Promoting fintech financing for SME in S. Caucasian and baltic states, during the COVID-19 global pandemic",2021,"Business, Management and Economics Engineering","19","2",,"358","372",,8,"10.3846/bmee.2021.14755","https://www.scopus.com/inward/record.uri?eid=2-s2.0-85121464960&doi=10.3846%2fbmee.2021.14755&partnerID=40&md5=30883fc7d86891fe6015945930e76a94","Faculty of Business and Technology, University of Business and Technology, Tbilisi, Georgia; School of Business and Governance, Department of Law, Tallinn University of Technology, Tallinn, Estonia; Faculty of Business Administration, Georgian Aviation University, Tbilisi, Georgia","Charaia, V., Faculty of Business and Technology, University of Business and Technology, Tbilisi, Georgia; Chochia, A., School of Business and Governance, Department of Law, Tallinn University of Technology, Tallinn, Estonia; Lashkhi, M., Faculty of Business Administration, Georgian Aviation University, Tbilisi, Georgia","Purpose – to analyse the digitalization trends in the Central Caucasian (Georgia, Azerbaijan and Armenia) and Baltic States with the aim of reducing a financial gap for the Small and Medium size Enterprises in Georgia, Azerbaijan and Armenia. Research methodology – comparative analysis between Baltic and Caucasian countries are made to analyse the basic positions and farther development opportunities for Georgia, Azerbaijan and Armenia. Findings of the given paper – while SME sector crucially important contributor to employment, diversification and productivity in any country of the world and especially in developing ones, they still face significant credit constraints through traditional credit providing institutions. However, the trend is changing and modern digital technologies from the fintech area are providing new alternatives, which already had been widely used in Baltic, but still are waiting their chance in Georgia, Azerbaijan and Armenia, with different level of progress and readiness. Research limitations – some statistical data does not exist for all six countries or were possible to obtain for different periods of time. Lack of academic literature on fintech in Caucasian countries. Practical implications – It can provide a useful perspective for researchers, academics, investors, investment managers, decision-makers, and scientists. Originality/Value – The paper analyses three advanced European Union member state’s (Lithuania, Latvia and Estonia) fintech positions and perspectives as a model of development for three developing Caucasian states (Georgia, Azerbaijan and Armenia). © 2021 The Author(s). Published by Vilnius Gediminas Technical University.","Alternative financing; Baltic States; Caucasian states; Financial gap; Fintech; Small and Medium-sized Enterprises",,"Chochia, A.; School of Business and Governance, Estonia; email: archil.chochia@taltech.ee",26692481,,,"Bus. Manag. Econ. Eng.",Article,"Final","All Open Access, Gold",Scopus
"Wójcik D.","7003319403;","Financial geography II: The impacts of FinTech – Financial sector and centres, regulation and stability, inclusion and governance",2021,"Progress in Human Geography","45","4",,"878","889",,18,"10.1177/0309132520959825","https://www.scopus.com/inward/record.uri?eid=2-s2.0-85091786394&doi=10.1177%2f0309132520959825&partnerID=40&md5=53650a6b2b78da6e8ec83c3f21eb75ce","University of Oxford, United Kingdom","Wójcik, D., University of Oxford, United Kingdom","In this report, I review interdisciplinary research on the actual and potential consequences of FinTech, with emphasis on ideas from and for geographers, and three areas: financial sector and centres, financial regulation and stability, and financial inclusion and governance. I show that the consequences of FinTech are full of controversies, which are part of broader, long-standing debates on the role of finance in economy and society, and need to be approached from geographical perspectives. The intense fusion of fin and tech, arguably accelerated by the COVID-19 pandemic, complicates and elevates these controversies to a new level. © The Author(s) 2020.","financial geography; financial governance; financial inclusion; financial regulation; financial stability; financial technology; FinTech","COVID-19; epidemic; financial market; governance approach; interdisciplinary approach; regulatory approach; research work","Wójcik, D.; University of OxfordUnited Kingdom; email: dariusz.wojcik@spc.ox.ac.uk",03091325,,,"Prog. Hum. Geogr.",Article,"Final","All Open Access, Hybrid Gold, Green",Scopus
"Soon S.","57283062000;","Improving the digital financial services ecosystem through collaboration of regulators and FinTech companies",2021,"FinTech, Artificial Intelligence and the Law: Regulation and Crime Prevention",,,,"46","63",,,,"https://www.scopus.com/inward/record.uri?eid=2-s2.0-85116202752&partnerID=40&md5=72648e127667948d671c5e632548019e","FinTech start-up, MyMy Payments Malaysia, Malaysia","Soon, S., FinTech start-up, MyMy Payments Malaysia, Malaysia",[No abstract available],,,"Soon, S.; FinTech start-up, Malaysia",,9781000412628; 9781032012469,,"FinTech, Artif. Intell. and the Law: Regul. and Crime Prev.",Book Chapter,"Final","",Scopus
"Jiang X., Wang X., Ren J., Xie Z.","57225919926;56025147100;57225879509;36783815000;","The nexus between digital finance and economic development: Evidence from China",2021,"Sustainability (Switzerland)","13","13","7289","","",,22,"10.3390/su13137289","https://www.scopus.com/inward/record.uri?eid=2-s2.0-85109633878&doi=10.3390%2fsu13137289&partnerID=40&md5=e4e4462f5efcc096cb972ec756aabefa","School of Economics and Management, Tongji University, Shanghai, 200092, China","Jiang, X., School of Economics and Management, Tongji University, Shanghai, 200092, China; Wang, X., School of Economics and Management, Tongji University, Shanghai, 200092, China; Ren, J., School of Economics and Management, Tongji University, Shanghai, 200092, China; Xie, Z., School of Economics and Management, Tongji University, Shanghai, 200092, China","In the context of the digital economy and based on the characteristics of digital financial development in China, this paper investigates the effect of digital finance on economic growth and explores its influencing mechanism. A panel econometric model, mediating effect model, and instrumental variable method were employed to evaluate yearly data from 30 provinces of China from 2011 to 2018. The results show that the development of digital finance has significantly driven economic growth, which is quantitatively robust after the selection of historical data as instrumental variables and other robustness tests. A heterogeneity analysis proved that provinces in the central and western regions, which have a lower urbanization rate and lower physical capital, more clearly embody the facilitating impacts of digital finance on economic growth compared to their counterparts in other regions. Further analysis found that the development of digital finance has spurred the liberation of regional entrepreneurship, which in turn promoted economic growth—that is, there is an entrepreneurial channel by which digital finance could boost economic growth. © 2021 by the authors. Licensee MDPI, Basel, Switzerland.","China; Digital finance; Economic growth; Entrepreneurship","economic development; economic growth; heterogeneity; spatiotemporal analysis; urbanization; China","Ren, J.; School of Economics and Management, China; email: 1830376@tongji.edu.cn",20711050,,,"Sustainability",Article,"Final","All Open Access, Gold, Green",Scopus
"Rowbottom N., Locke J., Troshani I.","8306049600;8241673300;16242596300;","When the tail wags the dog? Digitalisation and corporate reporting",2021,"Accounting, Organizations and Society","92",,"101226","","",,8,"10.1016/j.aos.2021.101226","https://www.scopus.com/inward/record.uri?eid=2-s2.0-85100442784&doi=10.1016%2fj.aos.2021.101226&partnerID=40&md5=cd4558b480dd3b2fcd3dbc7a23c2420f","Department of Accounting, Birmingham Business School, College of Social Sciences, University of BirminghamUK  B15 2TT, United Kingdom; The Open University, Milton Keynes, MK7 6AA, United Kingdom; Adelaide Business School, University of Adelaide, 10 Pulteney Street, Adelaide, 5005, Australia","Rowbottom, N., Department of Accounting, Birmingham Business School, College of Social Sciences, University of BirminghamUK  B15 2TT, United Kingdom; Locke, J., The Open University, Milton Keynes, MK7 6AA, United Kingdom; Troshani, I., Adelaide Business School, University of Adelaide, 10 Pulteney Street, Adelaide, 5005, Australia","To facilitate digital corporate reporting and enable computers to ‘read’ accounting information, standard-setters must construct a taxonomy to assign contextual ‘metadata’ that codifies disclosures arising from accounting concepts, standards and practices. But digitalisation poses a problem for corporate reporting. Within internationally accepted accounting practice, ‘principles-based’ standards give companies significant discretion in deciding what they disclose and how they report accounts of their activity. How would the principles-based nature of corporate reporting be influenced by the construction of a taxonomy that seeks to specify all accounting disclosures? Drawing on literature examining the constitutive potential of classification and formal representation, we use our case study of the digitalisation project undertaken by the global standard-setter, the IASB, to understand how digitalisation intervenes on standard-setting and reporting practice despite the intentions of standard-setters. Our results detail how standard-setters sought to minimise the impact of digitalisation by modelling the taxonomy only on disclosures explicitly required by accounting standards. We reveal the circumstances that led the IASB to change its taxonomy design by seeking to capture not only what should be reported (as prescribed in extant accounting standards) but also what was being reported (as prescribed in a new classification called ‘Common Practices’). We analyse the process by which international accounting disclosure practices were judged to be ‘common’, and demonstrate how the ‘Common Practices’ classification was perceived by early users of the taxonomy. When interpreting the IASB's Common Practices (what is) as disclosure standards (what should be), digitalisation generates a self-validating feedback loop that can generate more homogenous corporate reporting and push International Financial Reporting Standards beyond the principles-based approach they were designed to engender. Although standard-setters became increasingly aware of the influence of the digital (machine-readable) ‘tail’ on the traditional reporting (human-readable) ‘dog’, their attempts to take tighter control of the taxonomy development process strengthened user perceptions that the taxonomy and its ‘Common Practices’ represented an authoritative view of what should be reported. Our results reveal the process by which digital reporting both represents and intervenes in accounting, and how digitalisation impacts key accounting debates. As digitalisation attempts to provide a universal codification of reporting disclosures, it valorises comprehensive machine-friendly disclosure rules over principles, which offer standardised comparability over entity-specific communication. Our study also offers a perspective on the relations between information representation and intervention that moves beyond a study of passive, ‘reactive’ conformance to consider how representations can intervene despite the intentions of those generating the representation. In doing so, we reveal the constitutive potential of digital representations in generating ‘non-passive’ conformance. © 2021 The Authors","Digital reporting; Digitalisation; Digitisation; Financial reporting; Taxonomy; XBRL",,"Rowbottom, N.; Department of Accounting, United Kingdom; email: n.rowbottom@bham.ac.uk",03613682,,,"Account. Organ. Soc.",Article,"Final","All Open Access, Hybrid Gold, Green",Scopus
"Witt A., Huggins A., Governatori G., Buckley J.","57209653386;35589878300;6602545579;57226698296;","Converting copyright legislation into machine-executable code: Interpretation, coding validation and legal alignment",2021,"Proceedings of the 18th International Conference on Artificial Intelligence and Law, ICAIL 2021",,,,"139","148",,3,"10.1145/3462757.3466083","https://www.scopus.com/inward/record.uri?eid=2-s2.0-85112371821&doi=10.1145%2f3462757.3466083&partnerID=40&md5=ef5708d134df1c21a1e340fdb2e8fc34","Queensland University of Technology, Brisbane, QLD, Australia; Data61, Dutton Park, QLD, Australia","Witt, A., Queensland University of Technology, Brisbane, QLD, Australia; Huggins, A., Queensland University of Technology, Brisbane, QLD, Australia; Governatori, G., Data61, Dutton Park, QLD, Australia; Buckley, J., Data61, Dutton Park, QLD, Australia","A critical challenge in ""Rules as Code""(""RaC"") initiatives is enhancing legal accuracy. In this paper, we present the preliminary results of a two-week, first of its kind experiment that aims to shed light on how different legally trained people interpret and convert Australian Commonwealth legislation into machine-executable code. We find that coders collaboratively agreeing on key legal terms, or atoms, before commencing independent coding work can significantly increase the similarity of their encoded rules. Participants nonetheless made a range of divergent interpretive choices, which we argue are most likely due to: (1) the complexity of statutory interpretation, (2) encoded provisions having varying levels of granularity, and (3) the functionality of our coding language. Based on these findings, we draw an important distinction between processes for technical validation of encoded rules, which focus on ensuring rules adhere to select coding languages and conventions, and processes of legal alignment, which we conceptualise as enhancing congruence between the encoded provisions and the true meaning of the statutory text in line with the modern approach to statutory interpretation. We argue that these processes are distinct but both critically important in enhancing the accuracy of encoded rules. We conclude by emphasising the need in RaC initiatives for multi-disciplinary expertise across specific legal subject matters, statutory interpretation and technical programming. © 2021 ACM.","digitising legislation; legal alignment; machine-executable code; rules as code; statutory interpretation; technical processes","Alignment; Codes (symbols); Coding languages; Copyright legislation; Critical challenges; Executable codes; Most likely; Subject matters; Artificial intelligence",,,9781450385268,,"Proc. Int. Conf. Artif. Intell. Law, ICAIL",Conference Paper,"Final","All Open Access, Green",Scopus
"Rosário A.T.","57222987322;","Combining e-commerce and blockchain technologies to solve problems and improve business results: A literature review",2021,"Political and Economic Implications of Blockchain Technology in Business and Healthcare",,,,"173","192",,,"10.4018/978-1-7998-7363-1.ch006","https://www.scopus.com/inward/record.uri?eid=2-s2.0-85129661362&doi=10.4018%2f978-1-7998-7363-1.ch006&partnerID=40&md5=ea893902da542683a1811d780b141f90","IADE-Faculty of Design, Technology, and Communication, European University, Portugal","Rosário, A.T., IADE-Faculty of Design, Technology, and Communication, European University, Portugal","The internet and digital transformation have changed our relations with the market. These technologies have been developing continuously, creating opportunities for new business models, and e-commerce has grown overwhelmingly worldwide, changing the consumption process of a large part of the world's population. Companies are increasingly using blockchain technology to improve and create new global trading business models. Blockchain had its first application in cryptocurrencies, but it has quickly become a major solution in all sorts of activity sectors, providing increased security in commercial transactions. An important question is how the blockchain can leverage e-commerce in solving problems and improving business results. It was concluded that blockchain could leverage e-commerce in the four fundamental areas of (1) e-commerce financial transactions, (2) e-commerce supply chain management, (3) e-commerce forecasting and contractual relations, and (4) e-commerce transactions systems' trust and credibility. © 2021 by IGI Global.",,,"Rosário, A.T.; IADE-Faculty of Design, Portugal",,9781799873655; 9781799873631,,"Polit. and Econ. Implic. of Blockchain Technol. in Bus. and Healthc.",Book Chapter,"Final","",Scopus
"Clements R.","57224821959;","Regulating fintech in Canada and the United States: Comparison, challenges and opportunities",2021,"The Routledge Handbook of FinTech",,,,"416","454",,,,"https://www.scopus.com/inward/record.uri?eid=2-s2.0-85108371949&partnerID=40&md5=adc63ed466136df46518dd86d0a6b02f","University of Calgary Faculty of Law, Canada","Clements, R., University of Calgary Faculty of Law, Canada",[No abstract available],,,"Clements, R.; University of Calgary Faculty of LawCanada",,9781000375701; 9780367263591,,"The Rout. Handb. of FinTech",Book Chapter,"Final","",Scopus
"Chen Z., Li J., Zhang X., Li X., Zeng J., Wang S., Zhang W.","56099170900;57224832807;57224828413;57224414052;57224807694;57345696500;57224819467;","The restructure of China's banking industry by artificial intelligence and fintech",2021,"The Routledge Handbook of FinTech",,,,"263","301",,1,,"https://www.scopus.com/inward/record.uri?eid=2-s2.0-85108316036&partnerID=40&md5=6658a905c0cab8f4da90de0d58d3bbe7","School of Business, Sun Yat-sen University, China; Foshan University, China","Chen, Z., School of Business, Sun Yat-sen University, China; Li, J., Foshan University, China; Zhang, X., School of Business, Sun Yat-sen University, China; Li, X., School of Business, Sun Yat-sen University, China; Zeng, J., School of Business, Sun Yat-sen University, China; Wang, S., School of Business, Sun Yat-sen University, China; Zhang, W., School of Business, Sun Yat-sen University, China",[No abstract available],,,"Chen, Z.; School of Business, China",,9781000375701; 9780367263591,,"The Rout. Handb. of FinTech",Book Chapter,"Final","",Scopus
"Rabbani M.R., Bashar A., Nawaz N., Karim S., Ali M.A.M., Rahiman H.U., Alam M.S.","57216123332;57224082058;57203928103;57213153629;57225851287;57224953070;57190415757;","Exploring the role of islamic fintech in combating the aftershocks of covid-19: The open social innovation of the islamic financial system",2021,"Journal of Open Innovation: Technology, Market, and Complexity","7","2","136","","",,25,"10.3390/joitmc7020136","https://www.scopus.com/inward/record.uri?eid=2-s2.0-85106857466&doi=10.3390%2fjoitmc7020136&partnerID=40&md5=44606ead29694811cb423b0185870d52","Department of Economics and Finance, University of Bahrain, Zallaq, 32038, Bahrain; School of Management, IMS Unison University, Dehradun, 248009, India; Department of Management, Kingdom University, Riffa, 40438, Bahrain; School of Economics, Finance and Banking, College of Business, Universiti Utara Malaysia, Sintok, 06010, Malaysia; Department of Management and Marketing, University of Bahrain, Zallaq, 32038, Bahrain; Department of Finance and Economics, College of Commerce & Business Administration, Dhofar University, Salalah, 211, Oman","Rabbani, M.R., Department of Economics and Finance, University of Bahrain, Zallaq, 32038, Bahrain; Bashar, A., School of Management, IMS Unison University, Dehradun, 248009, India; Nawaz, N., Department of Management, Kingdom University, Riffa, 40438, Bahrain; Karim, S., School of Economics, Finance and Banking, College of Business, Universiti Utara Malaysia, Sintok, 06010, Malaysia; Ali, M.A.M., Department of Management and Marketing, University of Bahrain, Zallaq, 32038, Bahrain; Rahiman, H.U., Department of Management, Kingdom University, Riffa, 40438, Bahrain; Alam, M.S., Department of Finance and Economics, College of Commerce & Business Administration, Dhofar University, Salalah, 211, Oman","The purpose of the current study is to investigate the role of the Islamic financial system in recovery post-COVID-19 and the way Fintech can be utilized to combat the economic reverberations created by COVID-19. The global financial crisis of 2008 has established the credentials of the Islamic financial system as a sustainable financial system which can save the long run interests of the average citizens around the world while adding value to the real economy. The basic ethical tenets available in the Islamic financial system make it more suited and readymade to fight the economic aftershocks of a pandemic like COVID-19. The basic principles of ethical Islamic finance have solid connections to financial stability and corporate social responsibility within the wide-reaching business context. With the emergence of Financial technology (Fintech) it has provided a missing impetus to the Islamic financial system to compete on equal ground with its conventional counterpart and prove its mettle. The study uses discourse analysis along with the content analysis to extract content and draw a conclusion. The findings of the study indicate that COVID-19 pandemic has provided the opportunity for the social and open innovation to grow and finance world have turned to open innovation to provide a speedy, timely, reliable, and sustainable solution to the world. The findings of the study provide significant implications for governments and policy makers in efficient application of Fintech and innovative Islamic financial services to fight the economic consequences of the COVID-19 pandemic. © 2021 by the authors. Licensee MDPI, Basel, Switzerland.","COVID-19; Islamic banking; Islamic economics; Open innovation; Post COVID-19; Social finance",,"Rabbani, M.R.; Department of Economics and Finance, Bahrain; email: mrabbani@uob.edu.bh
Nawaz, N.; Department of Management, Bahrain; email: n.navaz@ku.edu.bh",21998531,,,"J. Open Innov.: Technol. Mark. Complex.",Article,"Final","All Open Access, Gold, Green",Scopus
