Authors,Author(s) ID,Title,Year,Source title,Volume,Issue,Art. No.,Page start,Page end,Page count,Cited by,DOI,Link,Affiliations,Authors with affiliations,Abstract,Author Keywords,Index Keywords,Correspondence Address,ISSN,ISBN,CODEN,Abbreviated Source Title,Document Type,Publication Stage,Open Access,Source
"Singh C., Zhao L., Lin W., Ye Z.","56409345900;57226554307;57217310795;57217302675;","Can machine learning, as a RegTech compliance tool, lighten the regulatory burden for charitable organisations in the United Kingdom?",2022,"Journal of Financial Crime","29","1",,"45","61",,3,"10.1108/JFC-06-2021-0131","https://www.scopus.com/inward/record.uri?eid=2-s2.0-85111936829&doi=10.1108%2fJFC-06-2021-0131&partnerID=40&md5=96bcb32e3833a9af1dd3a5bfcfe31108","Holborn Chambers and Business School, University of Westminster, London, United Kingdom; School of Law, University of Chinese Academy of Social Sciences, Beijing, China; Department of Law, Coventry University, Coventry, United Kingdom; 3PB, London, United Kingdom","Singh, C., Holborn Chambers and Business School, University of Westminster, London, United Kingdom; Zhao, L., School of Law, University of Chinese Academy of Social Sciences, Beijing, China; Lin, W., Department of Law, Coventry University, Coventry, United Kingdom; Ye, Z., 3PB, London, United Kingdom","Purpose: Machine learning is having a major impact on banking, law and other organisations. The speed with which this technology is developing to undertake tasks that are not only complex and technical but also time-consuming and that are subject to constantly changing parameters is astounding. The purpose of this paper is to explore the extent to which machine learning can be used as a solution to lighten the compliance and regulatory burden on charitable organisations in the UK; so that they can comply with their regulatory duties and develop a coherent and streamlined action plan in relation to technological investment. Design/methodology/approach: The subject is approached through the analysis of data, literature and domestic and international regulation. The first part of the study summarises the extent of current regulatory obligations faced by charities, these are then, in the second part, set against the potential technological solutions provided by machine learning as of July 2021. Findings: It is suggested that charities can use machine learning as a smart technological solution to ease the regulatory burden they face in a growing and impactful sector. Originality/value: The work is original because it is the first to specifically explore how machine learning as a technological advance can assist charities in meeting the regulatory compliance challenge. © 2021, Emerald Publishing Limited.","CharityTech; English law; Machine learning; RegTech; Unsupervised learning",,"Singh, C.; Holborn Chambers and Business School, United Kingdom; email: c.Singh1@westminster.ac.uk",13590790,,,"J. Financ. Crime",Article,"Final","All Open Access, Green",Scopus
"Lorenzoni I.","58071094300;","Why do Competition Authorities need Artificial Intelligence?",2022,"Yearbook of Antitrust and Regulatory Studies","15","26",,"33","55",,,"10.7172/1689-9024.YARS.2022.15.26.2","https://www.scopus.com/inward/record.uri?eid=2-s2.0-85146517259&doi=10.7172%2f1689-9024.YARS.2022.15.26.2&partnerID=40&md5=73841ae5aa9a1a3f049c0478b4357d89","University of Luxembourg, Luxembourg","Lorenzoni, I., University of Luxembourg, Luxembourg","Recent technological developments are transforming the way antitrust is enforced as well as the way market players are infringing competition law. As a result, enforcers are starting to equip themselves with sophisticated digital investigation tools. This paper explores this interest in building an Artificial Intelligence (AI) arsenal for the fight against algorithmic infringements. What are the key factors motivating regulators to develop their own technological tools to enforce competition law? Building on interviews with a number of competition authorities, this paper finds that changes in digital markets, the need for enforcers to reverse-engineer companies’ algorithms in order to better understand their implications for competition law, the need to enhance efficiency and keep pace with the fast evolution of the digital economy, and, finally, the decrease in leniency applications, are all reasons for which competition authorities should strive for more innovative and alternative means to boost their ex officio investigations. © 2022, University of Warsaw. All rights reserved.","Artificial Intelligence; Competition law; digital economy; digital market; enforcement",,"Lorenzoni, I.; University of LuxembourgLuxembourg; email: isabella.lorenzoni@uni.lu",16899024,,,"Yearbook of Antitrust Regul. Stud.",Article,"Final","All Open Access, Gold, Green",Scopus
"Arrifin N.H., Subramanian U.","58040207600;57194214959;","Blockchain in Banking",2022,"2022 International Conference on Information Technology Systems and Innovation, ICITSI 2022 - Proceedings",,,,"58","63",,,"10.1109/ICITSI56531.2022.9970827","https://www.scopus.com/inward/record.uri?eid=2-s2.0-85145440186&doi=10.1109%2fICITSI56531.2022.9970827&partnerID=40&md5=29e41c169747bd2d2311b543270724b2","Universiti Teknologi Brunei, Accounting, Bandar Seri Begawan, Brunei Darussalam","Arrifin, N.H., Universiti Teknologi Brunei, Accounting, Bandar Seri Begawan, Brunei Darussalam; Subramanian, U., Universiti Teknologi Brunei, Accounting, Bandar Seri Begawan, Brunei Darussalam","Blockchain technology is one of the innovations in financial technology that serves as the backbone of Bitcoin and Cryptocurrency. A blockchain is a secure ledger of all data transfer activities that eliminate the need for third-party involvement. It is a technology that records transactions using distributed databases and cryptography. There are three types of blockchain which are public, private, and Consortium or Federated blockchain. Many industries have used blockchain technology. Blockchain in banking is one of the industries that use blockchain the most and need by the country and organization. Many use cases on blockchain in banking, such as Know Your Customer (KYC), clearing and settlement, trade finance, payments, smart contract, and syndicated loans. These use cases could see the impact of implementing blockchain in banking. © 2022 IEEE.","Banking; Blockchain; Consortium; Cryptocurrency","Bitcoin; Data transfer; Distributed ledger; Banking IS; Block-chain; Consortium; Distributed database; Public-private; Third parties; Transfer activities; Blockchain",,,9781665465557,,"Int. Conf. Inf. Technol. Syst. Innov., ICITSI - Proc.",Conference Paper,"Final","",Scopus
"Firmansyah B., Arman A.A.","58040141800;56039352800;","A Systematic Literature Review of RegTech: Technologies, Characteristics, and Architectures",2022,"2022 International Conference on Information Technology Systems and Innovation, ICITSI 2022 - Proceedings",,,,"310","315",,,"10.1109/ICITSI56531.2022.9970830","https://www.scopus.com/inward/record.uri?eid=2-s2.0-85145436112&doi=10.1109%2fICITSI56531.2022.9970830&partnerID=40&md5=e37af3c0de76df158f54ba9951cc3ca9","School of Electrical Engineering and Informatics, Institut Teknologi Bandung, Bandung, Indonesia","Firmansyah, B., School of Electrical Engineering and Informatics, Institut Teknologi Bandung, Bandung, Indonesia; Arman, A.A., School of Electrical Engineering and Informatics, Institut Teknologi Bandung, Bandung, Indonesia","Regulatory Technology, or RegTech, uses information technology and digital innovation to help the financial services industry realize regulatory compliance. RegTech helps them to streamline compliance processes. Although dominant in the financial sector, ideally, RegTech can be implemented in various sectors other than finance. The critical elements of RegTech are regulated entities, supervisors and/or regulators, regulatory data, and data generated by regulated entities' activities. The technology at RegTech will bring all these elements together to achieve regulatory compliance. This study describes RegTech regarding technology utilization, characteristics, and architecture in the financial industry. The results of this study can be adopted as a basis for answering the challenges of implementing RegTech in various sectors of activity. Therefore, we used the systematic literature review approach to review several prior studies. Based on the search results, thirty-seven articles were chosen successfully for further review. RegTech focussed on four characteristics: Agility, speed, integration, and analytics. Various technologies are used in RegTech, such as big data analytics, artificial intelligence, machine learning, cloud computing, blockchain, etc. Generally, RegTech architecture components can be grouped into enterprise architecture (EA) layers: business, data, application, and technology. © 2022 IEEE.","architectures; characteristics; regtech; systematic literature review; technologies","Artificial intelligence; Cloud analytics; Computer architecture; Data Analytics; Engineering education; Regulatory compliance; Characteristic; Digital innovations; Financial sectors; Financial services industries; Information technology innovation; Regtech; Systematic literature review; Technology; Technology architectures; Technology characteristics; Finance",,,9781665465557,,"Int. Conf. Inf. Technol. Syst. Innov., ICITSI - Proc.",Conference Paper,"Final","",Scopus
"Ardiansyah A., Arman A.A.","58040251400;56039352800;","Regulation Compliance Supervision Technology: A Bibliometric Analysis",2022,"2022 International Conference on Information Technology Systems and Innovation, ICITSI 2022 - Proceedings",,,,"138","144",,,"10.1109/ICITSI56531.2022.9971071","https://www.scopus.com/inward/record.uri?eid=2-s2.0-85145434471&doi=10.1109%2fICITSI56531.2022.9971071&partnerID=40&md5=b3f95e448d1a6504f63162b002358120","School of Electrical Engineering and Informatics, Institut Teknologi Bandung, Bandung, Indonesia","Ardiansyah, A., School of Electrical Engineering and Informatics, Institut Teknologi Bandung, Bandung, Indonesia; Arman, A.A., School of Electrical Engineering and Informatics, Institut Teknologi Bandung, Bandung, Indonesia","Supervision of compliance with regulations or rules is an essential thing in an activity. The shift supervision method, which was previously paper-oriented, has now begun to shift to the use of technology for detection and analysis. This study investigates how the evolution of supervisory technology towards regulatory compliance as defined by the authority is discussed in the current academic literature, which is a systematic literature review that has not been found regarding the supervision of regulatory compliance. Using bibliographic analysis, 221 publications were used, which were taken from the Scopus database from 2008 to 2022. Then an analysis was carried out regarding the pattern of changes in research related to supervisory technology from year to year, the most influential studies, widely used journal sources and related keywords. In addition, other topics related to supervisory technology were also identified, such as the role of technology in fulfilling the supervision system's capabilities. The bibliometrix and VOSviewer program packages are used in the bibliometric analysis process. This study is expected to open new perspectives, especially in the academic world and practitioners, about what has been implemented and researched and identify opportunities for future studies. © 2022 IEEE.","bibliometrics; monitoring; regulation; Supervisory Technology; Suptech","Bibliographies; Software packages; 'current; Academic literature; Bibliographic analysis; Bibliometric; Bibliometrics analysis; Regulation; Regulation compliance; Supervisory technology; Suptech; Systematic literature review; Regulatory compliance",,,9781665465557,,"Int. Conf. Inf. Technol. Syst. Innov., ICITSI - Proc.",Conference Paper,"Final","",Scopus
"Kristanto A.D., Arman A.A.","58040193800;56039352800;","Towards A Smart Regulatory Compliance, the Capabilities of RegTech and SupTech",2022,"2022 International Conference on Information Technology Systems and Innovation, ICITSI 2022 - Proceedings",,,,"300","309",,,"10.1109/ICITSI56531.2022.9970801","https://www.scopus.com/inward/record.uri?eid=2-s2.0-85145434119&doi=10.1109%2fICITSI56531.2022.9970801&partnerID=40&md5=bf70ec9411c713118fffc4ad34bc0165","School of Electrical Engineering and Informatics, Bandung Institute of Technology, Bandung, Indonesia","Kristanto, A.D., School of Electrical Engineering and Informatics, Bandung Institute of Technology, Bandung, Indonesia; Arman, A.A., School of Electrical Engineering and Informatics, Bandung Institute of Technology, Bandung, Indonesia","Global financial crisis made the financial regulation volume increase. Financial institutions needed to interpret new regulations and swiftly adjusted to them. RegTech, Regulatory Technology, was born to ease the regulatory requirements compliance process. RegTech was then also adopted by supervisor and/or regulator to supervise the compliance of financial institutions. The adoption of RegTech by supervisor is called SupTech (Supervisory Technology). RegTech and SupTech were discussed mostly in banking or financial research. This paper tries to bring more nuance to information technology e.g., the capabilities and their underpinning technology. Hence, RegTech/SupTech can be more discussed in computer science research. This paper also concludes the definition of RegTech/Suptech and states one core capability of RegTech with its four pillars. © 2022 IEEE.","RegTech; Smart Regulatory Compliance; SupTech","Finance; Supervisory personnel; Computer science research; Core capabilities; Financial institution; Financial regulations; Global financial crisis; Regtech; Regulatory requirements; Smart regulatory compliance; Supervisory technology; Regulatory compliance",,,9781665465557,,"Int. Conf. Inf. Technol. Syst. Innov., ICITSI - Proc.",Conference Paper,"Final","",Scopus
"Masmoudi S.","57418383300;","Recent Trends in Crime Prevention: How are The Classical Approaches Renewed in The Digital Era?",2022,"Arab Journal of Forensic Sciences and Forensic Medicine","4","2",,"167","193",,,"10.26735/MOEY2066","https://www.scopus.com/inward/record.uri?eid=2-s2.0-85145403238&doi=10.26735%2fMOEY2066&partnerID=40&md5=ac79cc619ea056c65195337648c1828c","Department of Crime Prevention, College of Crime Sciences, Naif Arab University for Security Sciences, Saudi Arabia","Masmoudi, S., Department of Crime Prevention, College of Crime Sciences, Naif Arab University for Security Sciences, Saudi Arabia","Globalization and new forms of crime have increased the spread of violence and threats toward individuals and societies. It has become imperative to follow the recent trends in crime prevention, as they are proactive, partici-patory, stimulating the role of the individual and the com-munity, and using technology. For this reason, the paper aims to show the latest approaches and practices in preventing delinquency and crime. Based on an integrative literature review methodology using evaluation, analysis, and synthesis, this paper examined the new crime trends to analyze current prevention initiatives, practices, and strategies. The Kyoto Conference (March 2021) was a theoretical entry point for monitoring global trends in crime prevention. The analysis showed that prevention through social development, situational prevention, and communi-ty-based prevention remain the most used and practical approaches, greatly enhanced by using new technolo-gies. Results also showed that policies based on the city’s role and international coordination are among the latest trends. This paper also discussed the most critical tools in monitoring prevention programs, some models of comprehensive strategies, and the role of forensic sciences in developing prevention initiatives. Finally, the paper recommended making social development programs involving psychological factors a top priority, actively involving the community and civil society, creating an Arab observatory for crime, violence, and delinquency, founding a platform for the exchange of experiences and best practices, and launching an Arab Center for Youth Empowerment. The paper also recommended enhancing the role of forensic sciences in crime prevention, as they provide valuable data on the occurrence of criminal acts that can be used to predict and anticipate. © 2022. AJFSFM.","City-Based Prevention; Community; Crime Prevention; Forensic Science; Recent Trends; Situational Prevention; Social Development; Urban Safety; Violence",,"Masmoudi, S.; Department of Crime Prevention, Saudi Arabia; email: smasmoudi@nauss.edu.sa",16586786,,,"Arab. J. Forensic. Sci. Forensic. Med.",Review,"Final","All Open Access, Gold",Scopus
"Zhu J., Zou J., Jing Y., Yao W., Mo Y., Zheng Z.","58037439400;58037471800;58037405400;58037405500;58037405600;57932590300;","A Survey of Blockchain-Based Stablecoin: Cryptocurrencies and Central Bank Digital Currencies",2022,"Communications in Computer and Information Science","1679 CCIS",,,"177","193",,,"10.1007/978-981-19-8043-5_13","https://www.scopus.com/inward/record.uri?eid=2-s2.0-85145256601&doi=10.1007%2f978-981-19-8043-5_13&partnerID=40&md5=0e5916ba96c5e31564987f9c1ee15865","Guangzhou Municipal Local Financial Supervision and Administration, Guangzhou, 510000, China; GRGBanking Blockchain Express Inc. Pty., Guangzhou, 510000, China; Guangzhou Digital Finance Association, Guangzhou, 510000, China; School of Software Engineering, Sun Yat-sen University, Zhuhai, 519082, China","Zhu, J., Guangzhou Municipal Local Financial Supervision and Administration, Guangzhou, 510000, China; Zou, J., GRGBanking Blockchain Express Inc. Pty., Guangzhou, 510000, China; Jing, Y., Guangzhou Digital Finance Association, Guangzhou, 510000, China; Yao, W., Guangzhou Digital Finance Association, Guangzhou, 510000, China; Mo, Y., School of Software Engineering, Sun Yat-sen University, Zhuhai, 519082, China; Zheng, Z., School of Software Engineering, Sun Yat-sen University, Zhuhai, 519082, China","With the development of blockchain technology and regulation, blockchain-based stablecoins have explosive growth recently. Our study provides an overview of the applications and regulations of blockchain-based stablecoins, which not only provides a clear view of current development but also has important referential value for guiding regulatory strategies. We begin with a new categorization perspective based on the legal position, the stability mechanism, target user, and decentralization. Then, we investigate the technical application of real-world projects and analysis it comparatively. Further, we explore the different regulations technologies and policies of blockchain-based stablecoins. Finally, several unresolved difficulties and prospective future are discussed. © 2022, The Author(s), under exclusive license to Springer Nature Singapore Pte Ltd.","Blockchain; Central bank digital currencies; Cryptocurrencies; Regulation; Stablecoins","Electronic money; Laws and legislation; 'current; Block-chain; Central bank; Central bank digital currency; Decentralisation; Explosive growth; Regulation; Stability mechanisms; Stablecoin; Technical applications; Blockchain","Mo, Y.; School of Software Engineering, China; email: moyifan@inpluslab.com",18650929,9789811980428,,"Commun. Comput. Info. Sci.",Conference Paper,"Final","",Scopus
"Ellili N.O.D.","39261406000;","Is there any association between FinTech and sustainability? Evidence from bibliometric review and content analysis",2022,"Journal of Financial Services Marketing",,,,"","",,,"10.1057/s41264-022-00200-w","https://www.scopus.com/inward/record.uri?eid=2-s2.0-85144539174&doi=10.1057%2fs41264-022-00200-w&partnerID=40&md5=5099c7a5559b0aab7b9a264511e5b9ad","College of Business, Abu Dhabi University, P.O. Box 59911, Abu Dhabi, United Arab Emirates","Ellili, N.O.D., College of Business, Abu Dhabi University, P.O. Box 59911, Abu Dhabi, United Arab Emirates","This study highlights the latest trends in the literature on the relationship between FinTech and sustainability by applying a bibliometric review of documents published in the Scopus database. Bibliometric analysis is a quantitative method that allows researchers to highlight core foundations and recent trends in a specific research field. This analysis was based on trend, evolution, bibliometrics, mapping, and qualitative content analyses. Based on a bibliometric review of 59 papers retrieved from the Scopus database, this study explores the most frequent keywords; the most influential authors, organizations, and countries; the most cited papers; the most co-cited reference papers; and sources. Evolution analysis was conducted using CiteSpace; bibliometric and mapping analyses were performed using VOSviewer; and content analysis was performed using WordStat. The results identified three major clusters: sustainability performance, blockchain technology, and digital transformation. Additionally, the results reveal that the analysis of the association between FinTech and sustainability has experienced increasingly important growth in 2021, reflecting the importance of financial technologies and innovations in business. The findings of this study have implications for Fintech and sustainability research and highlight the importance of Fintech in the development and execution of sustainability strategies and practices, as well as the most relevant research methods. This study provides an overview of how the literature on the association between FinTech and sustainability has developed, as well as a summary of the most influential authors along with countries, organizations, and journal sources. This study offers an opportunity for future research in this field. © 2022, The Author(s), under exclusive licence to Springer Nature Limited.","Bibliometric analysis; CiteSpace; Content analysis; FinTech; Sustainability; VOSviewer",,"Ellili, N.O.D.; College of Business, P.O. Box 59911, United Arab Emirates; email: nejla.ellili@adu.ac.ae",13630539,,,"J. Finan. Serv. Mark.",Article,"Article in Press","All Open Access, Bronze",Scopus
"Mirzaei M.","57209571035;","Fintech market in Iran: an analysis of Fintech ecosystem and business models",2022,"Middle East Development Journal","14","2",,"323","336",,,"10.1080/17938120.2022.2143749","https://www.scopus.com/inward/record.uri?eid=2-s2.0-85144087983&doi=10.1080%2f17938120.2022.2143749&partnerID=40&md5=cacd50e4624e19877b652dc68098298a","Faculty of Business & Economics, German University of Technology in Oman, Halban, Oman","Mirzaei, M., Faculty of Business & Economics, German University of Technology in Oman, Halban, Oman","The global economic is restructured by the wave of deepened technological revolutions brought by the worldwide Fintech storm. To overhaul the rapid growth and expansion of the Fintech industry requires solid data about its market structure. This conceptual study attempts to provide the first inclusive analysis of the Iranian Fintech market as a major player in Middle East. Financial services in Iran are experiencing a quick shift and the adoption of electronic payments is growing rapidly. We identified 275 active Fintech companies in Iran. Our findings show that transaction volume of Fintechs in the payment segment is the largest Fintech solution in Iran amounted to approximately 166.8 billion dollars in 2020. Almost 0.9 million Iranians are using bank-independent personal financial management for analysis of their personal finances. Moreover, crowdfunding solution as a new landscape for financing and innovation is a noble experience in Iranian Fintech market that is growing slowly. The Fintech industry in Iran has great potential and strong infrastructure; however, comparing with the major hubs in the region, such as Abu Dhabi and Dubai, the Iranian Fintech industry requires more immersion. © 2022 Economic Research Forum.","crowdfunding; digital payment; financial startups; Fintech; Middle East",,"Mirzaei, M.; Faculty of Business & Economics, Halban, Oman; email: maryam.mirzaei@gutech.edu.om",17938120,,,"Middle East Dev. J.",Article,"Final","",Scopus
