Authors,Author(s) ID,Title,Year,Source title,Volume,Issue,Art. No.,Page start,Page end,Page count,Cited by,DOI,Link,Affiliations,Authors with affiliations,Abstract,Author Keywords,Index Keywords,Correspondence Address,ISSN,ISBN,CODEN,Abbreviated Source Title,Document Type,Publication Stage,Open Access,Source
[No author name available],[No author id available],"Compilation of references",2020,"Influence of FinTech on Management Transformation",,,,"234","267",,,,"https://www.scopus.com/inward/record.uri?eid=2-s2.0-85136387011&partnerID=40&md5=0c3d9baeb8e00830c779d3c73c7f1053",,"",[No abstract available],,,,,9781799871125; 9781799871101,,"Influ. of FinTech on Manag. Transform.",Book Chapter,"Final","",Scopus
"Mohamed H.","57215609192;","Beyond fintech: Technology applications for the islamic economy",2020,"Beyond Fintech: Technology Applications for the Islamic Economy",,,,"1","250",,2,"10.1142/11885","https://www.scopus.com/inward/record.uri?eid=2-s2.0-85114974924&doi=10.1142%2f11885&partnerID=40&md5=03f69dcdff5181f29bdc1f8cc1295563","Stellar Consulting Group, Singapore","Mohamed, H., Stellar Consulting Group, Singapore","Beyond Fintech: Technology Applications for the Islamic Economy is a follow-up to the first-ever Islamic Fintech book by the author (published in 2018) that provided linkages between Islamic Finance and disruptive technologies like the blockchain. In the wake of fintech as a new trend in financial markets, the ground-breaking book stressed the relevance of Islamic finance and its implications, when enabled by fintech, towards the development of the Islamic digital economy. While the earlier work discussed the crucial innovation, structural, and institutional development for financial technologies in Islamic Finance, this new research explores the multiple applications possible in the various sectors of the economy, within and beyond finance, that can be significantly transformed. These revolutionary applications involve the integration of AI, blockchain, data analytics, and Internet-of-Things (IoT) devices for a holistic solution to tackle the bottlenecks and other issues in existing processes of traditional systems. The principles of accountability, duty, justice, and transparency are the foundation of shaping the framework in achieving good governance in all institutions — public or private, Islamic or otherwise. Technologies like AI, blockchain, and IoT devices can operationalize the transparency and accountability that is required to eradicate poverty, distribute wealth, enhance micro-, small- and large-scale initiatives for social and economic development, and thus share prosperity for a moral system that enables a more secure and sustainable economy. © 2021 by World Scientific Publishing Co. Pte. Ltd..",,,"Mohamed, H.; Stellar Consulting GroupSingapore",,9789811222313; 9789811222306,,"Beyond Fintech: Technology Applications for the Islamic Economy",Book,"Final","",Scopus
"Kokh L., Kokh Y.","57202745294;57224081361;","Banks and Fintech-companies: Who's Catching up with Whom",2020,"ACM International Conference Proceeding Series",,,,"","",,,"10.1145/3446434.3446533","https://www.scopus.com/inward/record.uri?eid=2-s2.0-85123042287&doi=10.1145%2f3446434.3446533&partnerID=40&md5=c29b04aef8432e4503375d6ec5e39a8c","State Marine Technical University, Saint-Petersburg, Russian Federation","Kokh, L., State Marine Technical University, Saint-Petersburg, Russian Federation; Kokh, Y., State Marine Technical University, Saint-Petersburg, Russian Federation","The article analyzes the popular hypothesis that banks as independent financial institutions will cease to exist and their business will be taken over by fintech companies. Although many experts believe that in the confrontation between banks and fintech companies, banks are surrendering their competitive positions in the financial market to fintech companies, the article provides facts proving the opposite. The purpose of the study is to assess the competitive position of banks in comparison with fintech companies. The study used a systematic approach, comparative analysis, expert estimates, logical analysis. The article recognizes the fact that there are new competitors in the financial market. However, fintech companies are ahead of banks exclusively in technology, expanding the delivery channels of banking products to customers. The product line of banks is much larger than that of fintech companies. Banks, with the skills and experience of a highly professional banking business, have begun digital transformation. Today banks are transferring their business to new modern technologies. Banking leaders are becoming leaders among all financial market players. This is especially noticeable in Russia, where the largest bank, the Savings Bank of Russia, has officially announced a change in its business model. The Sber ecosystem, he created, marked the beginning of the transition to the next stage in the development of the fintech area. Summarizing the results of the study, the authors of this article proved that universal banks remain the leaders in the Russian financial market both in terms of product line and digital technologies, Russian banks began to develop the non-banking services sector and create integrated ecosystems. Also, the authors substantiated the onset of the era of fintech 4.0, identifying signs that allow making this conclusion. © 2020 ACM.","bank; bank ecosystem; banking products and services; competition; fintech; fintech companies; High-tech companies; neobank","Banking; Commerce; Ecosystems; Financial markets; Manufacture; Service industry; Comparative analysis; Competitive position; Delivery channels; Digital technologies; Digital transformation; Financial institution; Identifying signs; Modern technologies; Fintech",,,9781450388900,,"ACM Int. Conf. Proc. Ser.",Conference Paper,"Final","",Scopus
"Alaassar A., Mention A.-L., Aas T.H.","57201703237;56289905900;36674602800;","Exploring how social interactions influence regulators and innovators: The case of regulatory sandboxes",2020,"Technological Forecasting and Social Change","160",,"120257","","",,19,"10.1016/j.techfore.2020.120257","https://www.scopus.com/inward/record.uri?eid=2-s2.0-85089574443&doi=10.1016%2fj.techfore.2020.120257&partnerID=40&md5=2fa2c10a6dc64ffc009dab56f625b0f4","College of Business, RMIT University, Melbourne, Australia; School of Business and Law, University of Agder, Gimlemoen 19, Kristiansand, 4630, Norway; Visiting Scholar, Tampere University, Finland; Blockchain and Fintech Research Fellow, Singapore University of Social Sciences, Singapore","Alaassar, A., College of Business, RMIT University, Melbourne, Australia, School of Business and Law, University of Agder, Gimlemoen 19, Kristiansand, 4630, Norway; Mention, A.-L., College of Business, RMIT University, Melbourne, Australia, Visiting Scholar, Tampere University, Finland, Blockchain and Fintech Research Fellow, Singapore University of Social Sciences, Singapore; Aas, T.H., School of Business and Law, University of Agder, Gimlemoen 19, Kristiansand, 4630, Norway","Like incubators, regulatory sandboxes constitute a prominent mechanism to enable entrepreneurial activities that guide financial technology (FinTech) firms through regulatory frameworks in the financial industry. Because they are new, there is a lack of research on regulatory sandboxes; most studies have investigated legal aspects while overlooking the management perspective. To address this gap, this paper builds on incubation research studies to explore how social interactions within regulatory sandboxes influence the practices of regulators and regulatees, using social capital theory. An exploratory-abductive approach is adopted, using data collected from 16 semi-structured interviews. The findings indicate that regulator-regulatee social interactions increase the legitimacy, risk management capabilities, and knowledge of regulatory frameworks among regulatees and, as to regulators, increase their understanding of regulatory constraints and potential risks in enabling technologies, better inform them of regulatees’ support needs, and offer them early access to regulatory innovations. The findings also reveal that the practices of regulators and regulatees may be negatively affected due to lowered trust and discrepancies in expectations and underlying goals. This research contributes to the incubation literature by focusing on the micro and meso levels of knowledge exchange and the entrepreneurial finance literature by promoting the role of incubation models. © 2020 The Author(s)","Entrepreneurial finance; Financial technology (FinTech); Incubation model; Regulator-regulatee social interaction; Regulatory sandbox","Fintech; Risk management; Enabling technologies; Entrepreneurial activity; Finance literatures; Knowledge exchange; Management capabilities; Regulatory frameworks; Semi structured interviews; Social interactions; Knowledge management; entrepreneur; information technology; innovation; regulatory approach; research work; social change; technological development","Alaassar, A.; School of Business and Law, Gimlemoen 19, Norway; email: ahmad.alaassar@uia.no",00401625,,,"Technol. Forecast. Soc. Change",Article,"Final","All Open Access, Hybrid Gold, Green",Scopus
"Al-Faihani M., Al-Alawi A.I.","57221868648;12759581600;","A Literature Review of Organizational Cultural Drivers Affecting the Digital Transformation of the Banking Sector",2020,"2020 International Conference on Data Analytics for Business and Industry: Way Towards a Sustainable Economy, ICDABI 2020",,,"9325596","","",,2,"10.1109/ICDABI51230.2020.9325596","https://www.scopus.com/inward/record.uri?eid=2-s2.0-85100510362&doi=10.1109%2fICDABI51230.2020.9325596&partnerID=40&md5=27d1c184a6459e5496138156cb219126","University of Bahrain, Department of Management and Marketing, Sakhir, Bahrain","Al-Faihani, M., University of Bahrain, Department of Management and Marketing, Sakhir, Bahrain; Al-Alawi, A.I., University of Bahrain, Department of Management and Marketing, Sakhir, Bahrain","The purpose of this research article is to review literature related to the organizational cultural drivers that affect digital transformation in the banking sector. This article focused on combining the research done in both the digital transformation and the organizational culture fields. The methodology used a conceptual approach to structure and analyzed the information obtained from different sources. The findings show the importance of considering organizational culture while implementing digital transformation initiatives. Future research should focus on building literature in the field, both from a quantitative and qualitative aspect and in different cultures and industries to gain a deeper understanding of the topic. The main contribution is to provide additional literature combining both organizational culture with digital transformation, while focusing on the banking sector as only a few studies currently address these two topics. © 2020 IEEE.","Digital Transformation; Organizational Change; Organizational Culture; Organizational Transformation; Retail Banking Sector","Banking; Banking sectors; Conceptual approaches; Digital transformation; Literature reviews; Organizational cultures; Qualitative aspects; Industrial economics",,,9781728196756,,"Int. Conf. Data Anal. Bus. Ind.: Way Towards Sustain. Econ., ICDABI",Conference Paper,"Final","",Scopus
"Niu Z., Li R., Wu J., Cheng D., Zhang J.","57202424167;57219751927;57221513540;57191748068;7601354419;","IConViz: Interactive Visual Exploration of the Default Contagion Risk of Networked-Guarantee Loans",2020,"Proceedings - 2020 IEEE Conference on Visual Analytics Science and Technology, VAST 2020",,,"9308622","84","94",,3,"10.1109/VAST50239.2020.00013","https://www.scopus.com/inward/record.uri?eid=2-s2.0-85099812051&doi=10.1109%2fVAST50239.2020.00013&partnerID=40&md5=3a84ea8c92148df34afa0962089ebcda","Tianjin University, College of Intelligence and Computing, China; Shanghai Jiao Tong University, Department of Computer Science and Engineering, China","Niu, Z., Tianjin University, College of Intelligence and Computing, China; Li, R., Tianjin University, College of Intelligence and Computing, China; Wu, J., Tianjin University, College of Intelligence and Computing, China; Cheng, D., Shanghai Jiao Tong University, Department of Computer Science and Engineering, China; Zhang, J., Tianjin University, College of Intelligence and Computing, China","Groups of enterprises can serve as guarantees for one another and form complex networks when obtaining loans from commercial banks. During economic slowdowns, corporate default may spread like a virus and lead to large-scale defaults or even systemic financial crises. To help financial regulatory authorities and banks manage the risk associated with networked loans, we identified the default contagion risk, a pivotal issue in developing preventive measures, and established iConViz, an interactive visual analysis tool that facilitates the closed-loop analysis process. A novel financial metric, the contagion effect, was formulated to quantify the infectious consequences of guarantee chains in this type of network. Based on this metric, we designed and implemented a series of novel and coordinated views that address the analysis of financial problems. Experts evaluated the system using real-world financial data. The proposed approach grants practitioners the ability to avoid previous ad hoc analysis methodologies and extend coverage of the conventional Capital Accord to the banking industry. © 2020 IEEE.","Regulatory visualization; Visualization analytics","Complex networks; Finance; Risk assessment; Viruses; Commercial bank; Corporates; Economic slowdowns; Financial crisis; Large-scales; Preventive measures; Regulatory authorities; Regulatory visualization; Visual exploration; Visualization analytic; Visualization",,,9781728180090,,"Proc. - IEEE Conf. Vis. Anal. Sci. Technol., VAST",Conference Paper,"Final","All Open Access, Green",Scopus
"Malvagna U., Sciarrone Alibrandi A.","57220573191;57220581447;","Misselling in Self-placement and Bank Resolution under BRRD2",2020,"European Company and Financial Law Review","17","5",,"522","557",,,"10.1515/ecfr-2020-0023","https://www.scopus.com/inward/record.uri?eid=2-s2.0-85097368544&doi=10.1515%2fecfr-2020-0023&partnerID=40&md5=5773c86f955e942f028815a6b4656b18","Università Di. Trento, Italy; Università Cattolica Del Sacro Cuore, Milano, Italy","Malvagna, U., Università Di. Trento, Italy; Sciarrone Alibrandi, A., Università Cattolica Del Sacro Cuore, Milano, Italy",[No abstract available],,,,16132548,,,"Eur. Co. Financ. Law Rev.",Article,"Final","",Scopus
"Kadam S., Sethi M.","57219964833;55377359700;","Cross Section Analysis of the KBW Nasdaq Financial Technology Index",2020,"International Journal of Financial Research","11","5",,"450","468",,1,"10.5430/ijfr.vlIn5p450","https://www.scopus.com/inward/record.uri?eid=2-s2.0-85096344947&doi=10.5430%2fijfr.vlIn5p450&partnerID=40&md5=37cd43e8c2e9be12565245fa2c3a710c","Symbiosis International (Deemed University) (SIU) Lavale, Pune, India; Symbiosis Institute of Business Management (SIBM), Symbiosis International (Deemed University) (SIU), Bengaluru, India","Kadam, S., Symbiosis International (Deemed University) (SIU) Lavale, Pune, India; Sethi, M., Symbiosis Institute of Business Management (SIBM), Symbiosis International (Deemed University) (SIU), Bengaluru, India","Financial Technology (FinTech) has emerged as a potentially transformative force in the various financial segments. To track this new sector garnering investor attention, Keefe, Bruyette & Woods and Nasdaq, came up with KBW Nasdaq Financial Technology Index (KFTX) on July 18, 2016 comprising of 49 constituents. The objective of this paper is to compare KFTX performance with the leading market indices, including S&P 500 and Dow Jones Industrial Average index. The data is collected for a period of 12 months, 24 months and 34 months starting from July 18, 2016. The findings of the analysis suggest that the returns for KFTX are consistently higher for 12 months, 24 months and 34 months over S&P 500 and Dow Jones Industrial Average. The cross section analysis of the 48 KFTX index constituents sub-classified into eight categories representing several different financial industry groups and businesses indicate that for the 34 months period networks and payments gave returns of 82.1% and 71.6% whereas asset management business gave an average negative return of - 51.0% and the specialty marketplace lenders gave a return of 26.6%. This indicates a significant non-uniform growth within the FinTech industry. The findings motivate for an in-depth analysis of the various industry groups and businesses within the FinTech industry and to explore further the reasons and attributes which differentiate these sectors. The study has implications for policy makers, asset management companies and investors in terms of understanding and framing policies for FinTech investments. © 2020","FinTech; index return; KFTX",,"Kadam, S.; H1105, Udyognagar, Chinchwadgao, India; email: sureshkadam@gmail.com",19234023,,,"Int. J. Financial Res.",Article,"Final","",Scopus
"Hommel K., Bican P.M.","57219474733;56653390500;","Digital entrepreneurship in finance: fintechs and funding decision criteria",2020,"Sustainability (Switzerland)","12","19","8035","1","18",,21,"10.3390/su12198035","https://www.scopus.com/inward/record.uri?eid=2-s2.0-85092890447&doi=10.3390%2fsu12198035&partnerID=40&md5=377a700537340c61ca728c3909ee264d","Technology Management, University of Erlangen-Nuremberg, Fürth, 90762, Germany","Hommel, K., Technology Management, University of Erlangen-Nuremberg, Fürth, 90762, Germany; Bican, P.M., Technology Management, University of Erlangen-Nuremberg, Fürth, 90762, Germany","After the 2007–08 global financial crisis, research flourished on entrepreneurship through digital innovation in the financial market as well as on investors’ influence on digital technology-based entrepreneurs’ funding decisions. This study combines these two research streams to analyze the decision-making criteria for funding financial technology companies (fintechs), hybrid companies that combine digital entrepreneurship, technology, and banking. The study first uses prior literature to derive important characteristics to define fintechs and then uses 12 expert interviews to elaborate on decision-making criteria in funding. Except for smaller peculiarities, fintech funding does not appear to differ from that of other digital entrepreneurship in different markets, and—as with most digital business models—scalability was identified as a key criterion. Additionally, by serving as a major provider of money for young companies, banks have changed their role and positioning in funding new financial technology entrepreneurs. Through developments in digital technology, banks have shifted from traditional money-lending activities (i.e., debt-financing) to becoming stakeholders in fintechs and, hence, equity investors. We also describe how these formerly distinct fields have converged due to regulatory requirements, digital newcomers, and a need for constant innovation, with their future sustainable development dependent on sharing and collaboration. © 2020 by the authors. Licensee MDPI, Basel, Switzerland.","Decision criteria; Digital entrepreneurship; Fintech; Funding; Investors; Startups; Success factors; Venture capital","decision support system; equity; expert system; financial market; innovation; questionnaire survey; stakeholder; sustainable development","Bican, P.M.; Technology Management, Germany; email: peter.bican@fau.de",20711050,,,"Sustainability",Article,"Final","All Open Access, Gold, Green",Scopus
"Turki M., Hamdan A., Cummings R.T., Sarea A., Karolak M., Anasweh M.","57217296515;56825295800;57212809590;57003472200;55323902000;57003688700;","The regulatory technology “RegTech” and money laundering prevention in Islamic and conventional banking industry",2020,"Heliyon","6","10","e04949","","",,11,"10.1016/j.heliyon.2020.e04949","https://www.scopus.com/inward/record.uri?eid=2-s2.0-85092188778&doi=10.1016%2fj.heliyon.2020.e04949&partnerID=40&md5=f292ca1aad902f7ed229f609f5be21c4","Dean of College of Business and Finance, Ahlia University, Manama, Bahrain; Department of Accounting, Finance and Banking, College of Business and Finance, Ahlia University, Manama, Bahrain; Zayed University, Dubai, United Arab Emirates; Department of Finance and Banking, School of Business, Mutah University, Jordan","Turki, M., Department of Accounting, Finance and Banking, College of Business and Finance, Ahlia University, Manama, Bahrain; Hamdan, A., Dean of College of Business and Finance, Ahlia University, Manama, Bahrain; Cummings, R.T., Department of Accounting, Finance and Banking, College of Business and Finance, Ahlia University, Manama, Bahrain; Sarea, A., Department of Accounting, Finance and Banking, College of Business and Finance, Ahlia University, Manama, Bahrain; Karolak, M., Zayed University, Dubai, United Arab Emirates; Anasweh, M., Department of Finance and Banking, School of Business, Mutah University, Jordan","This study aims to illustrate the impact of adopting Regulatory technology (RegTech) innovations in banks on money laundering prevention effectiveness using Bahrain as a case study. Bahrain has strived to position itself as the banking center of the Arabian Gulf, hence the results of this novel research are informative of the practices in the region. The primary data for this study was collected through a survey instrument distributed to 100 bankers working in Bahrain with expertise in compliance. The results of multivariate analysis indicate that transactions monitoring through RegTech and cost- and time-saving aspects of RegTech, drive money laundering prevention effectiveness to a highly statistically significant extent. However, electronic know your customer (KYC) technologies are insignificant as drivers. This research not only sheds light on the efficacy of RegTech but also raises general awareness concerning the adoption and integration of RegTech platforms for fighting money laundering. In particular, the findings provide specific insights about the deployment of RegTech capabilities in banks in regional banking centers of modest scale. © 2020 The AuthorsRegulatory technology (RegTech); Anti money laundering (AML); Know your customer (KYC) Compliance; Business Management; Business Policy; Corporate finance; International Finance; Sustainable Business. © 2020 The Authors","Anti money laundering (AML); Business management; Business policy; Corporate finance; International finance; Know your customer (KYC) compliance; Regulatory technology (RegTech); Sustainable business",,"Hamdan, A.; Dean of College of Business and Finance, Bahrain; email: allamh3@hotmail.com",24058440,,,"Heliyon",Article,"Final","All Open Access, Gold, Green",Scopus
"Cheng M., Qu Y.","55694734200;57218381687;","Does bank FinTech reduce credit risk? Evidence from China",2020,"Pacific Basin Finance Journal","63",,"101398","","",,47,"10.1016/j.pacfin.2020.101398","https://www.scopus.com/inward/record.uri?eid=2-s2.0-85089013293&doi=10.1016%2fj.pacfin.2020.101398&partnerID=40&md5=8ff4d459722788cb349b810c22cc6893","School of Economics and Finance, Xi'an Jiaotong University, Xi'an, China","Cheng, M., School of Economics and Finance, Xi'an Jiaotong University, Xi'an, China; Qu, Y., School of Economics and Finance, Xi'an Jiaotong University, Xi'an, China","Using data from Chinese commercial banks between 2008 and 2017, this paper explores the effects of bank FinTech on credit risk. We first construct and measure a bank FinTech index using web crawler technology and word frequency analysis. The results show that the development of bank FinTech is faster in state-owned banks than in other banks. Moreover, among the five subareas of bank FinTech, the development of internet technology is ahead of artificial intelligence technology, blockchain technology, cloud computing technology, and big data technology. Then, the impacts of bank FinTech on credit risk are examined. We find that bank FinTech significantly reduces credit risk in Chinese commercial banks, and further analyses show that the negative effects of bank FinTech on credit risk are relatively weak among large banks, state-owned banks, and listed banks. © 2020 Elsevier B.V.","Bank FinTech; China; Commercial banks; Credit risk",,"Cheng, M.; School of Economics and Finance, China; email: chengmaoyong@126.com",0927538X,,PBFJE,"Pac. Basin Financ. J.",Article,"Final","",Scopus
