source_name,iso_source_name
PROCEEDINGS  2020 CHINESE AUTOMATION CONGRESS CAC 2020,"PROC - CHIN AUTOM CONGR, CAC"
PROCEEDINGS  2020 IEEE 11TH INTERNATIONAL CONFERENCE ON DEPENDABLE SYSTEMS SERVICES AND TECHNOLOGIES DESSERT 2020,"PROC - IEEE INT CONF DEPENDABLE SYST, SERV TECHNOL, DESSERT"
PROCEEDINGS  2020 IEEE 13TH INTERNATIONAL CONFERENCE ON SERVICES COMPUTING SCC 2020,"PROC - IEEE INT CONF SERV COMPUT, SCC"
PROCEEDINGS  2020 IEEE 22ND INTERNATIONAL CONFERENCE ON HIGH PERFORMANCE COMPUTING AND COMMUNICATIONS IEEE 18TH INTERNATIONAL CONFERENCE ON SMART CITY AND IEEE 6TH INTERNATIONAL CONFERENCE ON DATA SCIENCE AND SYSTEMS HPCCSMARTCITYDSS 2020,"PROC - IEEE INT CONF HIGH PERFORM COMPUT COMMUN, IEEE INT CONF SMART CITY IEEE INT CONF DATA SCI SYST, HPCC-SMARTCITY-DSS"
PROCEEDINGS  2020 IEEE 6TH INTL CONFERENCE ON BIG DATA SECURITY ON CLOUD BIGDATASECURITY 2020 2020 IEEE INTL CONFERENCE ON HIGH PERFORMANCE AND SMART COMPUTING HPSC 2020 AND 2020 IEEE INTL CONFERENCE ON INTELLIGENT DATA AND SECURITY IDS 2020,"PROC - IEEE INTL CONF BIG DATA SECUR CLOUD, BIGDATASECURITY, IEEE INTL CONF HIGH PERFORM SMART COMPUT, HPSC IEEE INTL CONF INTELL DATA SECUR, IDS"
PROCEEDINGS  2020 IEEE 7TH INTERNATIONAL CONFERENCE ON DATA SCIENCE AND ADVANCED ANALYTICS DSAA 2020,"PROC - IEEE INT CONF DATA SCI ADV ANAL, DSAA"
PROCEEDINGS  2020 IEEE INTERNATIONAL CONFERENCE ON BIG DATA AND SMART COMPUTING BIGCOMP 2020,"PROC - IEEE INT CONF BIG DATA SMART COMPUT, BIGCOMP"
PROCEEDINGS  2020 IEEE INTERNATIONAL CONFERENCE ON BIG DATA BIG DATA 2020,"PROC - IEEE INT CONF BIG DATA, BIG DATA"
PROCEEDINGS  2020 IEEE INTERNATIONAL CONFERENCE ON ENVIRONMENT AND ELECTRICAL ENGINEERING AND 2020 IEEE INDUSTRIAL AND COMMERCIAL POWER SYSTEMS EUROPE EEEIC  I AND CPS EUROPE 2020,"PROC - IEEE INT CONF ENVIRON ELECTR ENGI IEEE IND COMMER POWER SYST EUROPE, EEEIC / I CPS EUROPE"
PROCEEDINGS  2020 IEEE INTERNATIONAL SYMPOSIUM ON PARALLEL AND DISTRIBUTED PROCESSING WITH APPLICATIONS 2020 IEEE INTERNATIONAL CONFERENCE ON BIG DATA AND CLOUD COMPUTING 2020 IEEE INTERNATIONAL SYMPOSIUM ON SOCIAL COMPUTING AND NETWORKING AND 2020 IEEE INTERNATIONAL CONFERENCE ON SUSTAINABLE COMPUTING AND COMMUNICATIONS ISPABDCLOUDSOCIALCOMSUSTAINCOM 2020,"PROC - IEEE INT SYMP PARALLEL DISTRIB PROCESS APPL, IEEE INT CONF BIG DATA CLOUD COMPUT, IEEE INT SYMP SOC COMPUT NETW IEEE INT CONF SUSTAIN COMPUT COMMUN, ISPA-BDCLOUD-SOCIALCOM-SUSTAINCOM"
PROCEEDINGS  2020 IEEE INTERNATIONAL SYMPOSIUM ON PERFORMANCE ANALYSIS OF SYSTEMS AND SOFTWARE ISPASS 2020,"PROC - IEEE INT SYMP PERFORM ANAL SYST SOFTW, ISPASS"
PROCEEDINGS  2020 IEEE INTERNATIONAL SYMPOSIUM ON SUSTAINABLE ENERGY SIGNAL PROCESSING AND CYBER SECURITY ISSSC 2020,"PROC - IEEE INT SYMP SUSTAIN ENERGY, SIGNAL PROCESS CYBER SECUR, ISSSC"
PROCEEDINGS  2020 IEEE WORLD CONGRESS ON SERVICES SERVICES 2020,"PROC - IEEE WORLD CONGR SERV, SERVICES"
PROCEEDINGS  2020 IEEEWICACM INTERNATIONAL JOINT CONFERENCE ON WEB INTELLIGENCE AND INTELLIGENT AGENT TECHNOLOGY WIIAT 2020,"PROC - IEEE/WIC/ACM INT JT CONF WEB INTELL INTELL AGENT TECHNOL, WI-IAT"
PROCEEDINGS  2020 INNOVATIONS IN INTELLIGENT SYSTEMS AND APPLICATIONS CONFERENCE ASYU 2020,"PROC - INNOV INTELL SYST APPL CONF, ASYU"
PROCEEDINGS  2020 INTERNATIONAL CONFERENCE ON BIG DATA AND SOCIAL SCIENCES ICBDSS 2020,"PROC - INT CONF BIG DATA SOC SCI, ICBDSS"
PROCEEDINGS  2020 INTERNATIONAL CONFERENCE ON COMPUTATIONAL SCIENCE AND COMPUTATIONAL INTELLIGENCE CSCI 2020,"PROC - INT CONF COMPUT SCI COMPUT INTELL, CSCI"
PROCEEDINGS  2020 INTERNATIONAL CONFERENCE ON COMPUTER VISION IMAGE AND DEEP LEARNING CVIDL 2020,"PROC - INT CONF COMPUT VIS, IMAGE DEEP LEARN, CVIDL"
PROCEEDINGS  2020 INTERNATIONAL SEMINAR ON APPLICATION FOR TECHNOLOGY OF INFORMATION AND COMMUNICATION IT CHALLENGES FOR SUSTAINABILITY SCALABILITY AND SECURITY IN THE AGE OF DIGITAL DISRUPTION ISEMANTIC 2020,"PROC - INT SEMIN APPL TECHNOL INF COMMUN: IT CHALLENGES SUSTAIN, SCALABILITY, SECUR AGE DIGIT DISRUPT, ISEMANTIC"
PROCEEDINGS  2020 INTERNATIONAL SYMPOSIUM ON COMPUTER CONSUMER AND CONTROL IS3C 2020,"PROC - INT SYMP COMPUT, CONSUM CONTROL, IS3C"
PROCEEDINGS  2020 MANAGEMENT SCIENCE INFORMATIZATION AND ECONOMIC INNOVATION DEVELOPMENT CONFERENCE MSIEID 2020,"PROC - MANAG SCI INFORMATIZ ECON INNOV DEV CONF, MSIEID"
PROCEEDINGS  2021 23RD INTERNATIONAL CONFERENCE ON CONTROL SYSTEMS AND COMPUTER SCIENCE TECHNOLOGIES CSCS 2021,"PROC - INT CONF CONTROL SYST COMPUT SCI TECHNOL, CSCS"
PROCEEDINGS  2021 4TH INTERNATIONAL CONFERENCE ON INFORMATION AND COMPUTER TECHNOLOGIES ICICT 2021,"PROC - INT CONF INF COMPUT TECHNOL, ICICT"
PROCEEDINGS  2021 7TH INTERNATIONAL CONFERENCE ON EDUCATION AND TECHNOLOGY ICET 2021,"PROC - INT CONF EDUC TECHNOL, ICET"
PROCEEDINGS  2021 ASIAPACIFIC CONFERENCE ON COMMUNICATIONS TECHNOLOGY AND COMPUTER SCIENCE ACCTCS 2021,"PROC - ASIA-PACIFIC CONF COMMUN TECHNOL COMPUT SCI, ACCTCS"
PROCEEDINGS  2021 IEEE 45TH ANNUAL COMPUTERS SOFTWARE AND APPLICATIONS CONFERENCE COMPSAC 2021,"PROC - IEEE ANNU COMPUT, SOFTW, APPL CONF, COMPSAC"
PROCEEDINGS  2021 IEEE INTERNATIONAL CONFERENCE ON BIG DATA AND SMART COMPUTING BIGCOMP 2021,"PROC - IEEE INT CONF BIG DATA SMART COMPUT, BIGCOMP"
PROCEEDINGS  2021 IEEE INTERNATIONAL CONFERENCE ON INDUSTRY 40 ARTIFICIAL INTELLIGENCE AND COMMUNICATIONS TECHNOLOGY IAICT 2021,"PROC - IEEE INT CONF IND 40, ARTIF INTELL, COMMUN TECHNOL, IAICT"
PROCEEDINGS  2021 IEEE INTERNATIONAL CONFERENCE ON SOFTWARE ANALYSIS EVOLUTION AND REENGINEERING SANER 2021,"PROC - IEEE INT CONF SOFTW ANAL, EVOL REENGINEERING, SANER"
PROCEEDINGS  2021 IEEEACIS 6TH INTERNATIONAL CONFERENCE ON BIG DATA CLOUD COMPUTING AND DATA SCIENCE BCD 2021,"PROC - IEEE/ACIS INT CONF BIG DATA, CLOUD COMPUT, DATA SCI, BCD"
PROCEEDINGS  2021 INTERNATIONAL CONFERENCE OF SOCIAL COMPUTING AND DIGITAL ECONOMY ICSCDE 2021,"PROC - INT CONF SOC COMPUT DIGIT ECON, ICSCDE"
PROCEEDINGS  2021 INTERNATIONAL CONFERENCE ON BIG DATA ANALYSIS AND COMPUTER SCIENCE BDACS 2021,"PROC - INT CONF BIG DATA ANAL COMPUT SCI, BDACS"
PROCEEDINGS  2021 INTERNATIONAL CONFERENCE ON COMPUTER ENGINEERING AND ARTIFICIAL INTELLIGENCE ICCEAI 2021,"PROC - INT CONF COMPUT ENG ARTIF INTELL, ICCEAI"
PROCEEDINGS  20TH IEEEACIS INTERNATIONAL CONFERENCE ON SOFTWARE ENGINEERING ARTIFICIAL INTELLIGENCE NETWORKING AND PARALLELDISTRIBUTED COMPUTING SNPD 2019,"PROC - IEEE/ACIS INT CONF SOFTW ENG, ARTI INTELL, NETW PARALLEL/DISTRIB COMPUT, SNPD"
PROCEEDINGS  20TH IEEEACM INTERNATIONAL SYMPOSIUM ON CLUSTER CLOUD AND INTERNET COMPUTING CCGRID 2020,"PROC - IEEE/ACM INT SYMP CLUST, CLOUD INTERNET COMPUT, CCGRID"
PROCEEDINGS  2ND IEEE INTERNATIONAL CONFERENCE ON BIG DATA SECURITY ON CLOUD IEEE BIGDATASECURITY 2016 2ND IEEE INTERNATIONAL CONFERENCE ON HIGH PERFORMANCE AND SMART COMPUTING IEEE HPSC 2016 AND IEEE INTERNATIONAL CONFERENCE ON INTELLIGENT DATA AND SECURITY IEEE IDS 2016,"PROC - IEEE INT CONF BIG DATA SECUR CLOUD, IEEE BIGDATASECURITY, IEEE INT CONF HIGH PERFORM SMART COMPUT, IEEE HPSC IEEE INT CONF INTELL DATA SECUR, IEEE IDS"
PROCEEDINGS  2ND IEEE INTERNATIONAL CONFERENCE ON CYBER SECURITY AND CLOUD COMPUTING CSCLOUD 2015  IEEE INTERNATIONAL SYMPOSIUM OF SMART CLOUD IEEE SSC 2015,"PROC - IEEE INT CONF CYBER SECUR CLOUD COMPUT, CSCLOUD: IEEE INT SYMP OF SMART CLOUD IEEE SSC"
PROCEEDINGS  2ND IEEE INTERNATIONAL CONFERENCE ON ROBOTIC COMPUTING IRC 2018,"PROC - IEEE INT CONF ROBOT COMPUT, IRC"
PROCEEDINGS  32ND CONFERENCE ON GRAPHICS PATTERNS AND IMAGES SIBGRAPI 2019,"PROC - CONF GRAPH, PATTERNS IMAGES, SIBGRAPI"
PROCEEDINGS  3RD IEEE INTERNATIONAL CONFERENCE ON CYBER SECURITY AND CLOUD COMPUTING CSCLOUD 2016 AND 2ND IEEE INTERNATIONAL CONFERENCE OF SCALABLE AND SMART CLOUD SSC 2016,"PROC - IEEE INT CONF CYBER SECUR CLOUD COMPUT, CSCLOUD AND IEEE INT CONF SCALABLE SMART CLOUD, SSC"
PROCEEDINGS  3RD INTERNATIONAL CONFERENCE ON GREEN TECHNOLOGY AND SUSTAINABLE DEVELOPMENT GTSD 2016,"PROC - INT CONF GREEN TECHNOL SUSTAIN DEV, GTSD"
PROCEEDINGS  44TH EUROMICRO CONFERENCE ON SOFTWARE ENGINEERING AND ADVANCED APPLICATIONS SEAA 2018,"PROC - EUROMICRO CONF SOFTW ENG ADV APPL, SEAA"
PROCEEDINGS  5TH IEEE INTERNATIONAL CONFERENCE ON BIG DATA SERVICE AND APPLICATIONS BIGDATASERVICE 2019 WORKSHOP ON BIG DATA IN WATER RESOURCES ENVIRONMENT AND HYDRAULIC ENGINEERING AND WORKSHOP ON MEDICAL HEALTHCARE USING BIG DATA TECHNOLOGIES,"PROC - IEEE INT CONF BIG DATA SERV APPL, BIGDATASERVICE , WORKSHOP BIG DATA WATER RESOUR, ENVIRON, HYDRAUL ENG WORKSHOP MED, HEALTHC, USING BIG DATA TECHNOL"
PROCEEDINGS  5TH IEEEACM INTERNATIONAL CONFERENCE ON BIG DATA COMPUTING APPLICATIONS AND TECHNOLOGIES BDCAT 2018,"PROC - IEEE/ACM INT CONF BIG DATA COMPUT, APPL TECHNOL, BDCAT"
PROCEEDINGS  5TH INTERNATIONAL CONFERENCE ON INTELLIGENT COMPUTING AND CONTROL SYSTEMS ICICCS 2021,"PROC - INT CONF INTELL COMPUT CONTROL SYST, ICICCS"
PROCEEDINGS  AGILE 2008 CONFERENCE,PROC - AGILE CONF
PROCEEDINGS  ANNUAL COMPUTER SECURITY APPLICATIONS CONFERENCE ACSAC,PROC ANNU COMPUT SECUR APPL CONF ACSAC
PROCEEDINGS  DESIGN AUTOMATION CONFERENCE,PROC DES AUTOM CONF
PROCEEDINGS  IEEE 16TH INTERNATIONAL CONFERENCE ON DEPENDABLE AUTONOMIC AND SECURE COMPUTING IEEE 16TH INTERNATIONAL CONFERENCE ON PERVASIVE INTELLIGENCE AND COMPUTING IEEE 4TH INTERNATIONAL CONFERENCE ON BIG DATA INTELLIGENCE AND COMPUTING AND IEEE 3RD CYBER SCIENCE AND TECHNOLOGY CONGRESS DASCPICOMDATACOMCYBERSCITEC 2018,"PROC - IEEE INT CONF DEPENDABLE, AUTON SECUR COMPUT, IEEE INT CONF PERVASIVE INTELL COMPUT, IEEE INT CONF BIG DATA INTELL COMPUT IEEE CYBER SCI TECHNOL CONGR, DASC-PICOM-DATACOM-CYBERSCITEC"
PROCEEDINGS  IEEE 17TH INTERNATIONAL CONFERENCE ON DEPENDABLE AUTONOMIC AND SECURE COMPUTING IEEE 17TH INTERNATIONAL CONFERENCE ON PERVASIVE INTELLIGENCE AND COMPUTING IEEE 5TH INTERNATIONAL CONFERENCE ON CLOUD AND BIG DATA COMPUTING 4TH CYBER SCIENCE AND TECHNOLOGY CONGRESS DASCPICOMCBDCOMCYBERSCITECH 2019,"PROC - IEEE INT CONF DEPENDABLE, AUTON SECUR COMPUT, IEEE INT CONF PERVASIVE INTELL COMPUT, IEEE INT CONF CLOUD BIG DATA COMPU, CYBER SCI TECHNOL CONGR, DASC-PICOM-CBDCOM-CYBERSCITECH"
PROCEEDINGS  IEEE 2020 2ND INTERNATIONAL CONFERENCE ON ADVANCES IN COMPUTING COMMUNICATION CONTROL AND NETWORKING ICACCCN 2020,"PROC - IEEE INT CONF ADV COMPUT, COMMUN CONTROL NETW, ICACCCN"
PROCEEDINGS  IEEE 2021 INTERNATIONAL CONFERENCE ON COMPUTING COMMUNICATION AND INTELLIGENT SYSTEMS ICCCIS 2021,"PROC - IEEE INT CONF COMPUT, COMMUN, INTELL SYST, ICCCIS"
PROCEEDINGS  IEEE 2ND INTERNATIONAL CONFERENCE ON ARTIFICIAL INTELLIGENCE AND KNOWLEDGE ENGINEERING AIKE 2019,"PROC - IEEE INT CONF ARTIF INTELL KNOWL ENG, AIKE"
PROCEEDINGS  IEEE 9TH INTERNATIONAL CONFERENCE ON MOBILE ADHOC AND SENSOR NETWORKS MSN 2013,"PROC - IEEE INT CONF MOB AD-HOC SENS NETWORKS, MSN"
PROCEEDINGS  IEEE CONGRESS ON CYBERMATICS 2020 IEEE INTERNATIONAL CONFERENCES ON INTERNET OF THINGS ITHINGS 2020 IEEE GREEN COMPUTING AND COMMUNICATIONS GREENCOM 2020 IEEE CYBER PHYSICAL AND SOCIAL COMPUTING CPSCOM 2020 AND IEEE SMART DATA SMARTDATA 2020,"PROC - IEEE CONGR CYBERMATICS: IEEE INT CONF INTERNET THINGS, ITHINGS , IEEE GREEN COMPUT COMMUN, GREENCOM , IEEE CYBER, PHYS SOC COMPUT, CPSCOM IEEE SMART DATA, SMARTDATA"
PROCEEDINGS  IEEE INFOCOM,PROC IEEE INFOCOM
PROCEEDINGS  IEEE INTERNATIONAL CONFERENCE ON DATA MINING ICDM,PROC IEEE INT CONF DATA MIN ICDM
PROCEEDINGS  IEEE INTERNATIONAL CONFERENCE ON MOBILE DATA MANAGEMENT,PROC IEEE INT CONF MOBILE DATA MANAGE
PROCEEDINGS  IEEE INTERNATIONAL SYMPOSIUM ON CIRCUITS AND SYSTEMS,PROC IEEE INT SYMP CIRCUITS SYST
PROCEEDINGS  IEEE SYMPOSIUM ON COMPUTERS AND COMMUNICATIONS,PROC IEEE SYMP COMPUT COMMUN
PROCEEDINGS  IEEE SYMPOSIUM ON SECURITY AND PRIVACY,PROC IEEE SYMP SECUR PRIVACY
PROCEEDINGS  INTERNATIONAL COMPUTER SOFTWARE AND APPLICATIONS CONFERENCE,PROC INT COMPUT SOFTWARE APPL CONF
PROCEEDINGS  INTERNATIONAL CONFERENCE ON COMPUTER AND INFORMATION SCIENCES SUSTAINING TOMORROW WITH DIGITAL INNOVATION ICCOINS 2021,"PROC - INT CONF COMPUT INF SCI: SUSTAIN TOMORROW DIGIT INNOV, ICCOINS"
PROCEEDINGS  INTERNATIONAL CONFERENCE ON DATA ENGINEERING,PROC INT CONF DATA ENG
PROCEEDINGS  INTERNATIONAL CONFERENCE ON IMAGE PROCESSING ICIP,PROC INT CONF IMAGE PROCESS ICIP
PROCEEDINGS  INTERNATIONAL CONFERENCE ON MACHINE LEARNING AND CYBERNETICS,PROC INT CONF MACH LEARN CYBERN
PROCEEDINGS  INTERNATIONAL CONFERENCE ON NETWORK PROTOCOLS ICNP,PROC INT CONF NETW PROTOC ICNP
PROCEEDINGS  INTERNATIONAL CONFERENCE ON PATTERN RECOGNITION,PROC INT CONF PATTERN RECOGNIT
PROCEEDINGS  INTERNATIONAL CONFERENCE ON SOFTWARE ENGINEERING,PROC INT CONF SOFTWARE ENG
PROCEEDINGS  INTERNATIONAL CONFERENCE ON TOOLS WITH ARTIFICIAL INTELLIGENCE ICTAI,PROC INT CONF TOOLS ARTIF INTELL ICTAI
PROCEEDINGS  INTERNATIONAL SYMPOSIUM ON BIOMEDICAL IMAGING,IEEE COMPUT SOC CONF COMPUT VIS PATTERN RECOGN
PROCEEDINGS  INTERNATIONAL SYMPOSIUM ON PARALLEL ARCHITECTURES ALGORITHMS AND PROGRAMMING PAAP,"PROC - INT SYMP PARALLEL ARCHIT, ALGORITHMS AND PROGRAM, PAAP"
PROCEEDINGS  ISAMSR 2021 4TH INTERNATIONAL SYMPOSIUM ON AGENTS MULTIAGENTS SYSTEMS AND ROBOTICS,"PROC - ISAMSR : INT SYMP AGENTS, MULTI-AGENTS SYST ROBOT"
PROCEEDINGS 2018 3RD INTERNATIONAL CONFERENCE ON COMPUTATIONAL SYSTEMS AND INFORMATION TECHNOLOGY FOR SUSTAINABLE SOLUTIONS CSITSS 2018,"PROC INT CONF COMPUT SYST INF TECHNOL SUSTAIN SOLUTIONS, CSITSS"
PROCEEDINGS IECON 2018  44TH ANNUAL CONFERENCE OF THE IEEE INDUSTRIAL ELECTRONICS SOCIETY,PROCEEDINGS: IECON - ANNU CONF IEEE IND ELECTRON SOC
PROCEEDINGS OF 2016 IEEE ADVANCED INFORMATION MANAGEMENT COMMUNICATES ELECTRONIC AND AUTOMATION CONTROL CONFERENCE IMCEC 2016,"PROC IEEE ADV INF MANAG, COMMUN, ELECTRON AUTOM CONTROL CONF, IMCEC"
PROCEEDINGS OF 2017 IEEE 2ND INTERNATIONAL CONFERENCE ON CONTROL IN TECHNICAL SYSTEMS CTS 2017,"PROC IEEE INT CONF CONTROL IN TECHNICAL SYST, CTS"
PROCEEDINGS OF 2017 INTERNATIONAL CONFERENCE ON INFORMATION MANAGEMENT AND TECHNOLOGY ICIMTECH 2017,"PROC INT CONF INF MANAG TECHNOL, ICIMTECH"
PROCEEDINGS OF 2017 INTERNATIONAL CONFERENCE ON INTELLIGENT COMPUTING AND CONTROL I2C2 2017,"PROC INT CONF INTELL COMPUT CONTROL, I2C2"
PROCEEDINGS OF 2018 11TH INTERNATIONAL CONFERENCE QUOTMANAGEMENT OF LARGESCALE SYSTEM DEVELOPMENTQUOT MLSD 2018,"PROC INT CONF ""MANAG LARGE-SCALE SYST DEV"", MLSD"
PROCEEDINGS OF 2018 IEEE 4TH INFORMATION TECHNOLOGY AND MECHATRONICS ENGINEERING CONFERENCE ITOEC 2018,"PROC IEEE INF TECHNOL MECHATRONICS ENG CONF, ITOEC"
PROCEEDINGS OF 2018 IEEE 9TH INTERNATIONAL CONFERENCE ON DEPENDABLE SYSTEMS SERVICES AND TECHNOLOGIES DESSERT 2018,"PROC IEEE INT CONF DEPENDABLE SYST, SERV TECHNOL, DESSERT"
PROCEEDINGS OF 2018 IEEE INTERNATIONAL CONFERENCE OF SAFETY PRODUCE INFORMATIZATION IICSPI 2018,"PROC IEEE INT CONF SAF PROD INFORMATIZ, IICSPI"
PROCEEDINGS OF 2018 INTERNATIONAL CONFERENCE ON INFORMATION MANAGEMENT AND TECHNOLOGY ICIMTECH 2018,"PROC INT CONF INF MANAG TECHNOL, ICIMTECH"
PROCEEDINGS OF 2019 4TH INTERNATIONAL CONFERENCE ON INFORMATION TECHNOLOGY ENCOMPASSING INTELLIGENT TECHNOLOGY AND INNOVATION TOWARDS THE NEW ERA OF HUMAN LIFE INCIT 2019,"PROC INT CONF INF TECHNOL: ENCOMPASSING INTELL TECHNOL INNOV TOWARDS NEW ERA HUM LIFE, INCIT"
PROCEEDINGS OF 2019 IEEE 3RD INFORMATION TECHNOLOGY NETWORKING ELECTRONIC AND AUTOMATION CONTROL CONFERENCE ITNEC 2019,"PROC IEEE INF TECHNOL, NETW, ELECTRON AUTOM CONTROL CONF, ITNEC"
PROCEEDINGS OF 2019 IEEE 3RD INTERNATIONAL ELECTRICAL AND ENERGY CONFERENCE CIEEC 2019,"PROC IEEE INT ELECTR ENERGY CONF, CIEEC"
PROCEEDINGS OF 2019 IEEE 8TH DATA DRIVEN CONTROL AND LEARNING SYSTEMS CONFERENCE DDCLS 2019,"PROC IEEE DATA DRIVEN CONTROL LEARN SYST CONF, DDCLS"
PROCEEDINGS OF 2019 IEEE 8TH JOINT INTERNATIONAL INFORMATION TECHNOLOGY AND ARTIFICIAL INTELLIGENCE CONFERENCE ITAIC 2019,"PROC IEEE JT INT INF TECHNOL ARTIF INTELL CONF, ITAIC"
PROCEEDINGS OF 2019 INTERNATIONAL CONFERENCE ON INFORMATION MANAGEMENT AND TECHNOLOGY ICIMTECH 2019,"PROC INT CONF INF MANAG TECHNOL, ICIMTECH"
PROCEEDINGS OF 2020 23RD INTERNATIONAL CONFERENCE ON INFORMATION FUSION FUSION 2020,"PROC INT CONF INF FUSION, FUSION"
PROCEEDINGS OF 2020 5TH INTERNATIONAL CONFERENCE ON CLOUD COMPUTING AND ARTIFICIAL INTELLIGENCE TECHNOLOGIES AND APPLICATIONS CLOUDTECH 2020,"PROC INT CONF CLOUD COMPUT ARTIF INTELL: TECHNOL APPL, CLOUDTECH"
PROCEEDINGS OF 2020 5TH INTERNATIONAL CONFERENCE ON GREEN TECHNOLOGY AND SUSTAINABLE DEVELOPMENT GTSD 2020,"PROC INT CONF GREEN TECHNOL SUSTAIN DEV, GTSD"
PROCEEDINGS OF 2020 7TH IEEE INTERNATIONAL CONFERENCE ON BEHAVIOURAL AND SOCIAL COMPUTING BESC 2020,"PROC IEEE INT CONF BEHAV SOC COMPUT, BESC"
PROCEEDINGS OF 2020 ASIAPACIFIC CONFERENCE ON IMAGE PROCESSING ELECTRONICS AND COMPUTERS IPEC 2020,"PROC ASIA-PACIFIC CONF IMAGE PROCESS, ELECTRON COMPUT, IPEC"
PROCEEDINGS OF 2020 IEEE INTERNATIONAL CONFERENCE ON ADVANCES IN ELECTRICAL ENGINEERING AND COMPUTER APPLICATIONS AEECA 2020,"PROC IEEE INT CONF ADV ELECTR ENG COMPUT APPL, AEECA"
PROCEEDINGS OF 2020 INTERNATIONAL CONFERENCE ON INFORMATION MANAGEMENT AND TECHNOLOGY ICIMTECH 2020,"PROC INT CONF INF MANAG TECHNOL, ICIMTECH"
PROCEEDINGS OF 2021 2ND INTERNATIONAL CONFERENCE ON INTELLIGENT ENGINEERING AND MANAGEMENT ICIEM 2021,"PROC INT CONF INTELL ENG MANAG, ICIEM"
PROCEEDINGS OF 2021 IEEE 4TH INTERNATIONAL ELECTRICAL AND ENERGY CONFERENCE CIEEC 2021,"PROC IEEE INT ELECTR ENERGY CONF, CIEEC"
PROCEEDINGS OF 2021 INTERNATIONAL CONFERENCE ON INFORMATION MANAGEMENT AND TECHNOLOGY ICIMTECH 2021,"PROC INT CONF INF MANAG TECHNOL, ICIMTECH"
PROCEEDINGS OF 2ND IEEE INTERNATIONAL CONFERENCE ON COMPUTATIONAL INTELLIGENCE AND KNOWLEDGE ECONOMY ICCIKE 2021,"PROC IEEE INT CONF COMPUT INTELL KNOWL ECON, ICCIKE"
PROCEEDINGS OF 2ND INTERNATIONAL CONFERENCE ON COMPUTATION AUTOMATION AND KNOWLEDGE MANAGEMENT ICCAKM 2021,"PROC INT CONF COMPUT, AUTOM KNOWL MANAG, ICCAKM"
PROCEEDINGS OF BHTC 2020  1ST IEEE BANGALORE HUMANITARIAN TECHNOLOGY CONFERENCE,PROC B-HTC - IEEE BANGALORE HUMANIT TECHNOL CONF
PROCEEDINGS OF IEEE 7TH INTERNATIONAL CONFERENCE ON COMPUTER SCIENCE AND NETWORK TECHNOLOGY ICCSNT 2019,"PROC IEEE INT CONF COMPUT SCI NETW TECHNOL, ICCSNT"
PROCEEDINGS OF IEEE ASIAPACIFIC CONFERENCE ON IMAGE PROCESSING ELECTRONICS AND COMPUTERS IPEC 2021,"PROC IEEE ASIA-PACIFIC CONF IMAGE PROCESS, ELECTRON COMPUT, IPEC"
PROCEEDINGS OF IEEE INTERNATIONAL CONFERENCE ON SIGNAL PROCESSINGCOMPUTING AND CONTROL,"PROC IEEE INT CONF SIGNAL PROCESS, COMPUT CONTROL, ISPCC"
PROCEEDINGS OF IEEE SYMPOSIUM ON VISUAL LANGUAGES AND HUMANCENTRIC COMPUTING VLHCC,"PROC OF IEEE SYMP VIS LANG HUM-CENT COMPUT, VL/HCC"
PROCEEDINGS OF IEEEACS INTERNATIONAL CONFERENCE ON COMPUTER SYSTEMS AND APPLICATIONS AICCSA,"PROC IEEE/ACS INT CONF COMPUT SYST APPL, AICCSA"
PROCEEDINGS OF INTERNATIONAL CONFERENCE ON COMPUTATION AUTOMATION AND KNOWLEDGE MANAGEMENT ICCAKM 2020,"PROC INT CONF COMPUT, AUTOM KNOWL MANAG, ICCAKM"
PROCEEDINGS OF INTERNATIONAL CONFERENCE ON INNOVATIVE PRACTICES IN TECHNOLOGY AND MANAGEMENT ICIPTM 2021,"PROC INT CONF INNOV PRACT TECHNOL MANAG, ICIPTM"
PROCEEDINGS OF INTERNATIONAL CONFERENCE ON SERVICE SCIENCE ICSS,"PROC INT CONF SERV SCI, ICSS"
PROCEEDINGS OF ISSI 2015 ISTANBUL 15TH INTERNATIONAL SOCIETY OF SCIENTOMETRICS AND INFORMETRICS CONFERENCE,PROC ISSI ISTANBUL: INT SOC SCIENTOMETRICS INFORMETRICS CONF
PROCEEDINGS OF SPIE  THE INTERNATIONAL SOCIETY FOR OPTICAL ENGINEERING,PROC SPIE INT SOC OPT ENG
PROCEEDINGS OF THE 12TH INTERNATIONAL CONFERENCE ON ELECTRONICS COMPUTERS AND ARTIFICIAL INTELLIGENCE ECAI 2020,"PROC INT CONF ELECTRON, COMPUT ARTIF INTELL, ECAI"
PROCEEDINGS OF THE 13TH IEEE CONFERENCE ON INDUSTRIAL ELECTRONICS AND APPLICATIONS ICIEA 2018,"PROC IEEE CONF INDUSTRIAL ELECTRON APPL, ICIEA"
PROCEEDINGS OF THE 13TH USENIX SECURITY SYMPOSIUM,PROC USENIX SECUR SYMP
PROCEEDINGS OF THE 13TH USENIX SYMPOSIUM ON NETWORKED SYSTEMS DESIGN AND IMPLEMENTATION NSDI 2016,"PROC USENIX SYMP NETWORKED SYST DES IMPLEMENT, NSDI"
PROCEEDINGS OF THE 15TH EUROPEAN CONFERENCE ON COMPUTER SYSTEMS EUROSYS 2020,"PROC EUR CONF COMPUT SYST, EUROSYS"
PROCEEDINGS OF THE 15TH IEEE CONFERENCE ON INDUSTRIAL ELECTRONICS AND APPLICATIONS ICIEA 2020,"PROC IEEE CONF IND ELECTRON APPL, ICIEA"
PROCEEDINGS OF THE 15TH INTERNATIONAL CONFERENCE ON BUSINESS INFORMATION SYSTEMS 2020 DEVELOPMENTS OPPORTUNITIES AND CHALLENGES OF DIGITIZATION WIRTSCHAFTSINFORMATIK 2020,"PROC INT CONF BUS INF SYST ""DEV, OPPOR CHALLENGES DIGIT"", WIRTSCHAFTSINFORMATIK"
PROCEEDINGS OF THE 2008 INTERNATIONAL CONFERENCE ON ELEARNING EBUSINESS ENTERPRISE INFORMATION SYSTEMS AND EGOVERNMENT EEE 2008,"PROC INT CONF E-LEARNING, E-BUSINESS, ENTERP INF SYST, E-GOVERNMENT, EEE"
PROCEEDINGS OF THE 2015 7TH INTERNATIONAL CONFERENCE OF SOFT COMPUTING AND PATTERN RECOGNITION SOCPAR 2015,"PROC INT CONF SOFT COMPUT PATTERN RECOGNIT, SOCPAR"
PROCEEDINGS OF THE 2016 IEEEACM INTERNATIONAL CONFERENCE ON ADVANCES IN SOCIAL NETWORKS ANALYSIS AND MINING ASONAM 2016,"PROC IEEE/ACM INT CONF ADV SOC NETW ANAL MIN, ASONAM"
PROCEEDINGS OF THE 2017 FEDERATED CONFERENCE ON COMPUTER SCIENCE AND INFORMATION SYSTEMS FEDCSIS 2017,"PROC FED CONF COMPUT SCI INF SYST, FEDCSIS"
PROCEEDINGS OF THE 2017 IEEE 24TH INTERNATIONAL CONGRESS ON ELECTRONICS ELECTRICAL ENGINEERING AND COMPUTING INTERCON 2017,"PROC IEEE INT CONGR ELECTRON, ELECTR ENG COMPUT, INTERCON"
PROCEEDINGS OF THE 2017 IEEEACM INTERNATIONAL CONFERENCE ON ADVANCES IN SOCIAL NETWORKS ANALYSIS AND MINING ASONAM 2017,"PROC IEEE/ACM INT CONF ADV SOC NETW ANAL MIN, ASONAM"
PROCEEDINGS OF THE 2017 ITU KALEIDOSCOPE ACADEMIC CONFERENCE CHALLENGES FOR A DATADRIVEN SOCIETY ITU K 2017,"ITU KALEIDOSCOPE ACAD CONF: CHALL DATA-DRIVEN SOC, ITU K"
PROCEEDINGS OF THE 2018 13TH INTERNATIONAL CONFERENCE ON INNOVATIONS IN INFORMATION TECHNOLOGY IIT 2018,"PROC INT CONF INNOV INF TECHNOL, IIT"
PROCEEDINGS OF THE 2018 CYBER RESILIENCE CONFERENCE CRC 2018,"PROC CYBER RESIL CONF, CRC"
PROCEEDINGS OF THE 2018 IEEE INTERNATIONAL CONFERENCE ON PROGRESS IN INFORMATICS AND COMPUTING PIC 2018,"PROC IEEE INT CONF PROG INF COMPUT, PIC"
PROCEEDINGS OF THE 2018 IEEE SYMPOSIUM SERIES ON COMPUTATIONAL INTELLIGENCE SSCI 2018,"PROC IEEE SYMP SER COMPUT INTELL, SSCI"
PROCEEDINGS OF THE 2018 IEEEACM INTERNATIONAL CONFERENCE ON ADVANCES IN SOCIAL NETWORKS ANALYSIS AND MINING ASONAM 2018,"PROC IEEE/ACM INT CONF ADV SOC NETWORKS ANAL MINING, ASONAM"
PROCEEDINGS OF THE 2018 INTERNATIONAL CONFERENCE ON OPTIMIZATION AND APPLICATIONS ICOA 2018,"PROC INT CONF OPTIM APPL, ICOA"
PROCEEDINGS OF THE 2019 IEEE 9TH INTERNATIONAL CONFERENCE ON ADVANCED COMPUTING IACC 2019,"PROC IEEE INT CONF ADV COMPUT, IACC"
PROCEEDINGS OF THE 2019 IEEEACM INTERNATIONAL CONFERENCE ON ADVANCES IN SOCIAL NETWORKS ANALYSIS AND MINING ASONAM 2019,"PROC IEEE/ACM INT CONF ADV SOC NETWORKS ANAL MIN, ASONAM"
PROCEEDINGS OF THE 2020 14TH INTERNATIONAL CONFERENCE ON INNOVATIONS IN INFORMATION TECHNOLOGY IIT 2020,"PROC INT CONF INNOV INF TECHNOL, IIT"
PROCEEDINGS OF THE 2020 IEEE INTERNATIONAL CONFERENCE ON HUMANMACHINE SYSTEMS ICHMS 2020,"PROC IEEE INT CONF HUM-MACH SYST, ICHMS"
PROCEEDINGS OF THE 2021 8TH INTERNATIONAL CONFERENCE ON COMPUTING FOR SUSTAINABLE GLOBAL DEVELOPMENT INDIACOM 2021,"PROC INT CONF COMPUT SUSTAIN GLOB DEV, INDIACOM"
PROCEEDINGS OF THE 2021 IEEE 24TH INTERNATIONAL CONFERENCE ON COMPUTER SUPPORTED COOPERATIVE WORK IN DESIGN CSCWD 2021,"PROC IEEE INT CONF COMPUT SUPPORT COOP WORK DES, CSCWD"
PROCEEDINGS OF THE 21ST INTERNATIONAL MULTI TOPIC CONFERENCE INMIC 2018,"PROC INT MULTI TOP CONF, INMIC"
PROCEEDINGS OF THE 22ND PACIFIC ASIA CONFERENCE ON INFORMATION SYSTEMS  OPPORTUNITIES AND CHALLENGES FOR THE DIGITIZED SOCIETY ARE WE READY PACIS 2018,"PROC PAC ASIA CONF INF SYST - OPPOR CHALLENGES DIGIT SOC: WE READY?, PACIS"
PROCEEDINGS OF THE 22ND USENIX SECURITY SYMPOSIUM,PROC USENIX SECUR SYMP
PROCEEDINGS OF THE 23RD PACIFIC ASIA CONFERENCE ON INFORMATION SYSTEMS SECURE ICT PLATFORM FOR THE 4TH INDUSTRIAL REVOLUTION PACIS 2019,"PROC PAC ASIA CONF INF SYST: SECUR ICT PLATF IND REVOL, PACIS"
PROCEEDINGS OF THE 24TH PACIFIC ASIA CONFERENCE ON INFORMATION SYSTEMS INFORMATION SYSTEMS IS FOR THE FUTURE PACIS 2020,"PROC PAC ASIA CONF INF SYST: INF SYST (IS) FUTURE, PACIS"
PROCEEDINGS OF THE 25TH EUROPEAN CONFERENCE ON INFORMATION SYSTEMS ECIS 2017,"PROC EUR CONF INF SYST, ECIS"
PROCEEDINGS OF THE 28TH AUSTRALASIAN CONFERENCE ON INFORMATION SYSTEMS ACIS 2017,"PROC AUSTRALAS CONF INF SYST, ACIS"
PROCEEDINGS OF THE 29TH CHINESE CONTROL AND DECISION CONFERENCE CCDC 2017,"PROC CHIN CONTROL DECIS CONF, CCDC"
PROCEEDINGS OF THE 2ND INTERNATIONAL CONFERENCE ON ELECTRONICS AND SUSTAINABLE COMMUNICATION SYSTEMS ICESC 2021,"PROC INT CONF ELECTRON SUSTAIN COMMUN SYST, ICESC"
PROCEEDINGS OF THE 2ND INTERNATIONAL CONFERENCE ON INVENTIVE RESEARCH IN COMPUTING APPLICATIONS ICIRCA 2020,"PROC INT CONF INVEN RES COMPUT APPL, ICIRCA"
PROCEEDINGS OF THE 30TH CHINESE CONTROL AND DECISION CONFERENCE CCDC 2018,"PROC CHIN CONTROL DECIS CONF, CCDC"
PROCEEDINGS OF THE 31ST INTERNATIONAL BUSINESS INFORMATION MANAGEMENT ASSOCIATION CONFERENCE IBIMA 2018 INNOVATION MANAGEMENT AND EDUCATION EXCELLENCE THROUGH VISION 2020,"PROC INT BUS INF MANAG ASSOC CONF, IBIMA: INNOV MANAG EDUC EXCELL VIS"
PROCEEDINGS OF THE 32ND CHINESE CONTROL AND DECISION CONFERENCE CCDC 2020,"PROC CHIN CONTROL DECIS CONF, CCDC"
PROCEEDINGS OF THE 32ND INNOVATIVE APPLICATIONS OF ARTIFICIAL INTELLIGENCE CONFERENCE IAAI 2020,"PROC INNOV APPL ARTIF INTELL CONF, IAAI"
PROCEEDINGS OF THE 32ND INTERNATIONAL BUSINESS INFORMATION MANAGEMENT ASSOCIATION CONFERENCE IBIMA 2018  VISION 2020 SUSTAINABLE ECONOMIC DEVELOPMENT AND APPLICATION OF INNOVATION MANAGEMENT FROM REGIONAL EXPANSION TO GLOBAL GROWTH,"PROC INT BUS INF MANAG ASSOC CONF, IBIMA - VIS: SUSTAIN ECON DEV APPL INNOV MANAG REG EXPANS GLOB GROWTH"
PROCEEDINGS OF THE 33RD INTERNATIONAL BUSINESS INFORMATION MANAGEMENT ASSOCIATION CONFERENCE IBIMA 2019 EDUCATION EXCELLENCE AND INNOVATION MANAGEMENT THROUGH VISION 2020,"PROC INT BUS INF MANAG ASSOC CONF, IBIMA: EDUC EXCELL INNOV MANAG VIS"
PROCEEDINGS OF THE 3RD ANNUAL WORKSHOP ON COMPUTATIONAL LEARNING THEORY COLT 1990,"PROC ANNU WORKSHOP COMPUT LEARN THEORY, COLT"
